Artist,Title,Album,Year,Lyrics,Lyrics Link,pos,neu,neg,opp neg,final score
Bob Dylan,Beyond the Horizon,Modern Times,2006,"beyond the horizon, behind the sun. at the end of the rainbow life has only begun. in the long hours of twilight 'neath the stardust above. beyond the horizon it is easy to love. . my wretched heart's pounding. i felt an angel's kiss. my memories are drowning. in mortal bliss. beyond the horizon, in the springtime or fall. love waits forever for one and for all. . beyond the horizon across the divide. 'round about midnight, we'll be on the same side. down in the valley the water runs cold. beyond the horizon someone prayed for your soul. . i'm touched with desire. what don't i do?. i'll throw the logs on the fire. i'll build my world around you. beyond the horizon, at the end of the game. every step that you take, i'm walking the same. . beyond the horizon the night winds blow. the theme of a melody from many moons ago. the bells of st. mary, how sweetly they chime. beyond the horizon i found you just in time. . it's dark and it's dreary. i ponder in vain. i'm weakened, i'm weary. my repentance is plain. beyond the horizon o'er the treacherous sea. i still can't believe that you've set aside your love for me. . beyond the horizon, 'neath crimson skies. in the soft light of morning i'll follow you with my eyes. through countries and kingdoms and temples of stone. beyond the horizon right down to the bone. . it's late in the season. never knew, never cared. whatever the reason. someone's life has been spared. . beyond the horizon the sky is so blue. i've got more than a lifetime to live lovin' you",https://genius.com/Bob-dylan-beyond-the-horizon-lyrics,0.109,0.851,0.041,0.959,0.534
Bob Dylan,Rollin' and Tumblin',Modern Times,2006,"i rolled and i tumbled, i cried the whole night long. i rolled and i tumbled, i cried the whole night long. woke up this morning', i must have bet my money wrong. . i got troubles so hard, i can't stand the strain. i got troubles so hard, i just can't stand the strain. some young lazy slut has charmed away my brains. . the landscape is glowing', gleaming' in the golden light of day. the landscape is glowing', gleaming' in the gold light of day. i am not holding nothing' back now, i am not standing' in anybody's way. . well, i did all i know just to keep you off my mind. well, i did all i know just to keep you off my mind. well, i paid and i paid and my suffering' heart is always on the line. . well, i get up in the dawn and i go down and lay in the shade. i get up in the dawn and i go down and lay in the shade. i ain't nobody's house boy, i ain't nobody's well trained maid. . i'm flat-out spent, this woman has been driving' me to tears. i'm flat-out spent, this woman she has been driving' me to tears. this woman so crazy, i swear i ain't gonna touch another one for years. . well, the warm weather is coming' and the buds are on the vine. the warm weather's comin', the buds are on the vine. ain't nothing so depressing as trying to satisfy this woman of mine. . i got up this morning', saw the rising sun return. well, i got up this morning', seen the rising sun return. sooner or later you too shall burn. . the night's filled with shadows, the years are filled with early doom. the night's filled with shadows, the years are filled with early doom. i've been conjuring up all these long dead souls from their crumbling' tombs. . let's forgive each other darling', let's go down to the greenwood glen. let's forgive each other darling', let's go down to the greenwood glen. let's put our heads together, let's put old matters to an end. . now i rolled and i tumbled and i cried the whole night long. ah, i rolled and i tumbled, i cried the whole night long. i woke up this morning, i think i must be traveling' wrong",https://genius.com/Bob-dylan-rollin-and-tumblin-lyrics,0.086,0.781,0.133,0.867,0.4765
Bob Dylan,The Levee's Gonna Break,Modern Times,2006,"if it keeps on raining' the levee gonna break. if it keeps on raining' the levee gonna break. everybody saying this is a day only the lord could make. . well i worked on the levee mama, both night and day. well i worked on the levee mama, both night and day. i got to the river and i threw my clothes away. i paid my time and now i'm as good as new. i paid my time and now i'm as good as new. they can't take me back, not unless i want them to. . if it keeps on raining' the levee gonna break. if it keeps on raining' the levee gonna break. some of these people gonna strip you of all they can take. i can't stop here, i ain't ready to unload. i can't stop here, i ain't ready to unload. riches and salvation can be waiting. behind the next bend in the road. . i picked you up from the gutter and this is the thanks i get. i picked you up from the gutter and this is the thanks i get. you say you want me to quit ya, i told you no, not just yet. i look in your eyes, i see nobody else but me. i look in your eyes, i see nobody other than me. i see all that i am and all i hope to be. . if it keeps on raining' the levee gonna break. if it keeps on raining' the levee gonna break. some of these people don't know which road to take. when i'm with you i forget i was ever blue. when i'm with you i forget i was ever blue. without you there's no meaning in anything i do. . some people on the road carrying everything that they own. some people on the road carrying everything that they own. some people got barely enough skin to cover their bones. put on your cat clothes, mama, put on your evening dress. put on your cat clothes, mama, put on your evening dress. a few more years of hard work. then there'll be a thousand years of happiness. . if it keeps on raining' the levee gonna break. if it keeps on raining' the levee gonna break. i tried to get you to love me, but i won't repeat that mistake. if it keeps on raining' the levee gonna break. if it keeps on raining' the levee gonna break. plenty of cheap stuff out there still around that you take. . i woke up this morning, butter and eggs in my bed. i woke up this morning, butter and eggs in my bed. i ain't got enough room to even raise my head. come back, baby, say we never more will part. come back, baby, say we never more will part. don't be a stranger without a brain or heart. . if it keeps on raining' the levee gonna break. if it keeps on raining' the levee gonna break. some people still sleeping', some people are wide awake",https://genius.com/Bob-dylan-the-levees-gonna-break-lyrics,0.067,0.9,0.033,0.967,0.517
Bob Dylan,Lay Lady Lay,Nashville Skyline,1969,"lay, lady, lay. lay across my big brass bed. lay, lady, lay. lay across my big brass bed. whatever colors you have in your mind. i'll show them to you and you'll see them shine. . lay, lady, lay. lay across my big brass bed. stay, lady, stay. stay with your man awhile. until the break of day, let me see ya' make him smile. his clothes are dirty but his, his hands are clean. and you're the best thing that he's ever seen. . stay, lady, stay. stay with your man awhile. why wait any longer for the world to begin. you can have your cake and eat it too. why wait any longer for the one you love. when he's standing in front of you. . lay, lady, lay. lay across my big brass bed. stay, lady, stay. stay while the night is still ahead. i long to see you in the morning light. i long to reach for you in the night. stay, lady, stay. stay while the night is still ahead",https://genius.com/Bob-dylan-lay-lady-lay-lyrics,0.098,0.891,0.011,0.989,0.5435
Bob Dylan,Girl from the North Country (v2),Nashville Skyline,1969,if you're travelin' to the north country fair. where the winds hit heavy on the borderline. remember me to one who lives there. for she once was a true love of mine. . see for me that her hair's hangin' down. it curls and falls all down her breast. see for me that her hair's hangin' down. that's the way i remember her best. . if you go when the snowflakes fall. when the rivers freeze and summer ends. please see for me if she's wearing a coat so warm. to keep her from the howling winds. . if you're travelin' in the north country fair. where the winds hit heavy on the borderline. please say hello (remember me) to the one who lives there. for she once was a true love of mine. if you're travelin' in the north country fair. where the winds hit heavy on the borderline. remember me to the one who lives there. for she once was a true love of mine. . a true love of mine. a true love of mine. a true love of mine. a true love of mine. a true love of mine. a true love of mine. she once was a true love of mine,https://genius.com/Bob-dylan-girl-from-the-north-country-v2-lyrics,0.356,0.644,0,1,0.678
Bob Dylan,I Threw It All Away,Nashville Skyline,1969,"i once held her. in my arms. she said she would. always stay. but i was cruel. i treated her like a fool. i threw it all away. once i had mountains. in the palm of my hand. and rivers that ran through. every day. but i must have been mad. i never knew what i had. until i threw it all away. love is all there is. it makes the world go 'round. love and only love. it can't be denied. no matter what you think about it. you just won't be able to do without it. take a tip from one who's tried. so if you find someone. who gives you all of her love. take it to your heart, don't let it stray. for one thing for certain. you will surely be a-hurtin'. if you throw it all away. if you throw it all away",https://genius.com/Bob-dylan-i-threw-it-all-away-lyrics,0.212,0.678,0.11,0.89,0.551
Bob Dylan,To Be Alone with You,Nashville Skyline,1969,"is it rolling, bob?. . to be alone with you. just you and me. now won't you tell me true. ain't that the way it oughta be?. to hold each other tight. the whole night through. everything is always right. when i'm alone with you. . to be alone with you. at the close of the day. with only you in view. while evening slips away. it only goes to show. that while life's pleasures be few. the only one i know. is when i'm alone with you. . they say that nighttime is the right time. to be with the one you love. too many thoughts get in the way in the day. but you're always what i'm thinkin' of. i wish the night were here. bringin' me all of your charms. when only you are near. to hold me in your arms. . i'll always thank the lord. when my workin' day is through. i get my sweet reward. to be alone with you",https://genius.com/Bob-dylan-to-be-alone-with-you-lyrics,0.146,0.807,0.047,0.953,0.5495
Bob Dylan,Tonight I'll Be Staying Here with You,Nashville Skyline,1969,"throw my ticket out the window. throw my suitcase out there, too. throw my troubles out the door. i don't need them anymore. 'cause tonight i'll be staying here with you. . i should have left this town this morning. but it was more than i could do. oh, your love comes on so strong. and i've waited all day long. for tonight when i'll be staying here with you. . is it really any wonder. the love that a stranger might receive?. you cast your spell and i went under. i find it so difficult to leave. . i can hear that whistle blowin'. i see that stationmaster, too. if there's a poor boy on the street. then let him have my seat. 'cause tonight i'll be staying here with you. . throw my ticket out the window. throw my suitcase out there, too. throw my troubles out the door. i don't need them anymore. 'cause tonight i'll be staying here with you",https://genius.com/Bob-dylan-tonight-ill-be-staying-here-with-you-lyrics,0.099,0.808,0.092,0.908,0.5035
Bob Dylan,One More Night,Nashville Skyline,1969,"one more night, the stars are in sight. but tonight i'm as lonesome as can be. oh, the moon is shinin' bright. lighting everything in sight. but tonight no light will shine on me. . oh, it's shameful and it's sad i lost the only pal i had. i just could not be what she wanted me to be. i will turn my head up high. to that dark and rollin' sky. for tonight no light will shine on me. . i was so mistaken when i thought that she'd be true. i had no idea what a woman in love would do. . one more night, i will wait for the light. while the wind blows high above the tree. oh, i miss my darlin' so. i didn't mean to see her go. but tonight no light will shine on me. . one more night, the moon is shinin' bright. and the wind blows high above the tree. oh, i miss that woman so. i didn't mean to see her go. but tonight no light will shine on me",https://genius.com/Bob-dylan-one-more-night-lyrics,0.086,0.731,0.183,0.817,0.4515
Bob Dylan,Country Pie,Nashville Skyline,1969,"just like old saxophone joe. when he's got the hogshead up on his toe. oh me, oh my. love that country pie. . listen to the fiddler play. when he's playin' 'til the break of day. oh me, oh my. love that country pie. . raspberry, strawberry, lemon, and lime. what do i care?. blueberry, apple, cherry, pumpkin, and plum. call me for dinner, honey, i'll be there. . saddle me up my big white goose. tie me on her and turn her loose. oh me, oh my. love that country pie. . i don't need much, that ain't no lie. ain't runnin' any race. give to me my country pie. i won't throw it up in anybody's face. . shake me up that old peach tree. a'little jack horner got nothin' on me. oh me, oh my. love that country pie",https://genius.com/Bob-dylan-country-pie-lyrics,0.142,0.818,0.041,0.959,0.5505
Bob Dylan,Tell Me That It Isn't True,Nashville Skyline,1969,"i have heard rumors all over town. they say that you're planning to put me down. all i'd like you to do. is tell me that it isn't true. . they say that you've been seen with some other man. that he's tall, dark and handsome, and you're holdin' his hand. darling, i'm a'countin' on you. tell me that it isn't true. . to know that some other man is holdin' you tight. it hurts me all over, it doesn't seem right. all of these awful things that i have heard. i don't wanna believe them, all i want is your word. so darlin', you better come through. tell me that it isn't true. all of these awful things that i have heard. i don't want to believe them, all i want is your word. so darlin', i'm countin' on you. tell me that it isn't true",https://genius.com/Bob-dylan-tell-me-that-it-isnt-true-lyrics,0.19,0.754,0.056,0.944,0.567
Bob Dylan,You Belong to Me,Others,1994,"see the pyramids along the nile. watch the sun rise from a tropic isle. just remember, darling, all the while. you belong to me. see the market place in old algiers. send me photographs and souvenirs. just remember when a dream appears. you belong to me. i'll be so alone without you. maybe you'll be lonesome too... and blue. fly the ocean in a silver plane. see the jungle when it's wet with rain. just remember till you're home again. you belong to me. i'll be so alone without you. maybe you'll be lonesome too... and blue. fly the ocean in a silver plane. see the jungle when it's wet with rain. just remember till you're home again. you belong to me",https://genius.com/Bob-dylan-you-belong-to-me-lyrics,0.045,0.875,0.08,0.92,0.4825
Bob Dylan,The Man in Me,New Morning,1970,"the man in me will do nearly any task. and as for compensation, there's little he would ask. take a woman like you. to get through to the man in me. . storm clouds are raging all around my door. i think to myself i might not take it anymore. take a woman like your kind. to find the man in me. . but, oh, what a wonderful feeling. just to know that you are near. sets my heart a-reeling. from my toes up to my ears. . the man in me will hide sometimes to keep from bein' seen. but that's just because he doesn't want to turn into some machine. took a woman like you. to get through to the man in me",https://genius.com/Bob-dylan-the-man-in-me-lyrics,0.134,0.833,0.033,0.967,0.5505
Bob Dylan,If Not for You,New Morning,1970,"if not for you. babe, i couldn't find the door. couldn't even see the floor. i'd be sad and blue. if not for you. . if not for you. babe, i'd lay awake all night. wait for the morning light. to shine in through. but it would not be new. if not for you. . if not for you, my sky would fall. rain would gather too. without your love, i'd be nowhere at all. i'd be lost if not for you. and you know it's true. . if not for you, my sky would fall. rain would gather too. without your love, i'd be nowhere at all. oh, what would i do. if not for you. . if not for you. winter would have no spring. couldn't hear the robin sing. i just wouldn't have a clue. anyway it wouldn't ring true. if not for you. if not for you. if not for you. if not for you. if not for you",https://genius.com/Bob-dylan-if-not-for-you-lyrics,0.043,0.859,0.098,0.902,0.4725
Bob Dylan,Sign on the Window,New Morning,1970,"sign on the window says “lonely”. sign on the door said “no company allowed”. sign on the street says “y' don't own me”. sign on a porch says “three's a crowd”. sign on a porch says “three's a crowd”. . her and her boyfriend went to california. her and her boyfriend done changed their tune. my best friend said, “now didn't i warn you?. brighton girls are like the moon. brighton girls are like the moon”. . looks like a-nothing but rain. sure gonna be wet tonight on main street. hope that it don't sleet. . build me a cabin in utah. marry me a wife, catch rainbow trout. have a bunch of kids who call me “pa”. that must be what it's all about. that must be what it's all about",https://genius.com/Bob-dylan-sign-on-the-window-lyrics,0.137,0.863,0,1,0.5685
Bob Dylan,New Morning,New Morning,1970,"can't you hear that rooster crowing?. rabbit running down across the road. underneath the bridge where the water flowed through. so happy just to see you smile. underneath the sky of blue. on this new morning, new morning. on this new morning with you. . can't you hear that motor turning?. automobile coming into style. coming down the road for a country mile or two. so happy just to see you smile. underneath the sky of blue. on this new morning, new morning. on this new morning with you. . the night passed away so quickly. it always does when you're with me. . can't you feel that sun a-shining?. ground hog running by the country stream. this must be the day that all of my dreams come true. so happy just to be alive. underneath the sky of blue. on this new morning, new morning. on this new morning with you. . so happy just to be alive. underneath the sky of blue. on this new morning, new morning. on this new morning with you. new morning",https://genius.com/Bob-dylan-new-morning-lyrics,0.178,0.822,0,1,0.589
Bob Dylan,Day of the Locusts,New Morning,1970,"oh, the benches were stained with tears and perspiration. the birdies were flying from tree to tree. there was little to say, there was no conversation. as i stepped to the stage to pick up my degree. and the locusts sang off in the distance. yeah, the locusts sang such a sweet melody. oh, the locusts sang off in the distance. yeah, the locusts sang and they were singing for me. . i glanced into the chamber where the judges were talking. darkness was everywhere, it smelled like a tomb. i was ready to leave, i was already walking. but the next time i looked there was light in the room. and the locusts sang, yeah, it give me a chill. oh, the locusts sang such a sweet melody. oh, the locusts sang their high whining trill. yeah, the locusts sang and they were singing for me. . outside of the gates the trucks were unloading. the weather was hot, a-nearly 90 degrees. the man standing next to me, his head was exploding. well, i was praying the pieces wouldn't fall on me. yeah, the locusts sang off in the distance. yeah, the locusts sang such a sweet melody. oh, the locusts sang off in the distance. and the locusts sang and they were singing for me. . i put down my robe, picked up my diploma. took hold of my sweetheart and away we did drive. straight for the hills, the black hills of dakota. sure was glad to get out of there alive. and the locusts sang, well, it give me a chill. yeah, the locusts sang such a sweet melody. and the locusts sang with a high whining trill. yeah, the locusts sang and they was singing for me. singing for me, well, singing for me",https://genius.com/Bob-dylan-day-of-the-locusts-lyrics,0.204,0.764,0.031,0.969,0.5865
Bob Dylan,Most of the Time,Oh Mercy,1989,"most of the time. i'm clear focused all around. most of the time. i can keep both feet on the ground. i can follow the path, i can read the signs. stay right with it when the road unwinds. i can handle whatever i stumble upon. i don't even notice she gone. most of the time. . most of the time. it's well understood. most of the time. i wouldn't change it if i could. i can make it all match up, i can hold my own. i can deal with the situation right down to the bone. i can survive, i can endure. and i don't even think about her. most of the time. . most of the time. my head is on straight. most of the time. i'm strong enough not to hate. i don't build up illusion 'till it makes me sick. i ain't afraid of confusion no matter how thick. i can smile in the face of mankind. don't even remember what her lips felt like on mine. most of the time. . most of the time. she ain't even in my mind. i wouldn't know her if i saw her. she's that far behind. most of the time. i can't even be sure. if she was ever with me. or if i was ever with her. . most of the time. i'm halfway content. most of the time. i know exactly where it all went. i don't cheat on myself, i don't run and hide. hide from the feelings that are buried inside. i don't compromise and i don't pretend. i don't even care if i ever see her again. most of the time",https://genius.com/Bob-dylan-most-of-the-time-lyrics,0.1,0.843,0.057,0.943,0.5215
Bob Dylan,Ring Them Bells,Oh Mercy,1989,"ring them bells, ye heathen. from the city that dreams. ring them bells from the sanctuaries. 'cross the valleys and streams. for they're deep and they're wide. and the world's on its side. and time is running backwards. and so is the bride. . ring them bells st. peter. where the four winds blow. ring them bells with an iron hand. so the people will know. oh it's rush hour now. on the wheel and the plow. and the sun is going down. upon the sacred cow. . ring them bells sweet martha. for the poor man's son. ring them bells so the world will know. that god is one. oh the shepherd is asleep. where the willows weep. and the mountains are filled. with lost sheep. . ring them bells for the blind and the deaf. ring them bells for all of us who are left. ring them bells for the chosen few. who will judge the many when the game is through. ring them bells, for the time that flies. for the child that cries. when innocence dies. . ring them bells st. catherine. from the top of the room. ring them from the fortress. for the lilies that bloom. oh the lines are long. and the fighting is strong. and they're breaking down the distance. between right and wrong",https://genius.com/Bob-dylan-ring-them-bells-lyrics,0.077,0.84,0.083,0.917,0.497
Bob Dylan,Man in the Long Black Coat,Oh Mercy,1989,"crickets are chirping, the water is high. there's a soft cotton dress on the line hangin' dry. window wide open, african trees. bent over backwards from a hurricane breeze. not a word of goodbye, not even a note. she gone with the man. in the long black coat. . somebody seen him hanging around. at the old dance hall on the outskirts of town. he looked into her eyes when she stopped him to ask. if he wanted to dance, he had a face like a mask. somebody said from the bible he'd quote. there was dust on the man. in the long black coat. . preacher was a talkin', there's a sermon he gave. he said every man's conscience is vile and depraved. you cannot depend on it to be your guide. when it's you who must keep it satisfied. it ain't easy to swallow, it sticks in the throat. she gave her heart to the man. in the long black coat. . there are no mistakes in life some people say. it is true sometimes you can see it that way. but people don't live or die, people just float. she went with the man. in the long black coat. . there's smoke on the water, it's been there since june. tree trunks uprooted, 'neath the high crescent moon. feel the pulse and vibration and the rumbling force. somebody is out there beating a dead horse. she never said nothing, there was nothing she wrote. she gone with the man. in the long black coat",https://genius.com/Bob-dylan-man-in-the-long-black-coat-lyrics,0.05,0.884,0.066,0.934,0.492
Bob Dylan,Everything Is Broken,Oh Mercy,1989,"broken lines, broken strings. broken threads, broken springs. broken idols, broken heads. people sleeping in broken beds. ain't no use jiving. ain't no use joking. everything is broken. . broken bottles, broken plates. broken switches, broken gates. broken dishes, broken parts. streets are filled with broken hearts. broken words never meant to be spoken. everything is broken. seem like every time you stop and turn around. something else just hit the ground. . broken cutters, broken saws. broken buckles, broken laws. broken bodies, broken bones. broken voices on broken phones. take a deep breath, feel like you're choking. everything is broken. every time you leave and go off someplace. things fall to pieces in my face. . broken hands on broken ploughs. broken treaties, broken vows. broken pipes, broken tools. people bending broken rules. hound dog howling, bullfrog croaking. everything is broken",https://genius.com/Bob-dylan-everything-is-broken-lyrics,0.031,0.438,0.53,0.47,0.2505
