Artist,Title,Album,Year,Lyrics,Lyrics Link,pos,neu,neg,opp neg,final score
Bob Dylan,Early Roman Kings,Tempest,2012,"all the early roman kings in their sharkskin suits. bowties and buttons, high top boots. driving the spikes in, blazing the rails. nailed in their coffins in top hats and tails. fly away little bird, fly away, flap your wings. fly by night like the early roman kings. all the early roman kings in the early, early morn'. coming down the mountain, distributing the corn. speeding through the forest, racing down the track. you try to get away, they drag you back. tomorrow is friday, we'll see what it brings. everybody's talking ‘bout the early roman kings. they're peddlers and they're meddlers, they buy and they sell. they destroyed your city, they'll destroy you as well. they're lecherous and treacherous, hell bent for leather. each of them bigger than all men put together. sluggers and muggers wearing fancy gold rings. all the women going crazy for the early roman kings. i'll dress up your wounds with a blood clotted rag. i ain't afraid to make love to a bitch or a hag. if you see me coming and you're standing there. wave your handkerchief in the air. i ain't dead yet, my bell still rings. i keep my fingers crossed like the early roman kings. i'll strip you of life, strip you of breath. ship you down to the house of death. one day you will ask for me. there'll be no one else that you'll want to see. bring down my fiddle, tune up my strings. gonna break it wide open like the early roman kings. i was up on black mountain the day detroit fell. they killed them all off and they sent them to hell. ding dong daddy, you're coming up short. gonna put you on trial in a sicilian court. i've had my fun, i've had my flings. gonna shake ‘em all down like the early roman kings",https://genius.com/Bob-dylan-early-roman-kings-lyrics,0.071,0.812,0.117,0.883,0.477
Bob Dylan,Long and Wasted Years,Tempest,2012,"it's been such a long long time. since we loved each other when our hearts were true. one time, for one brief day, i was the man for you. last night i heard you talking in your sleep. saying things you shouldn't say, oh baby. you just may have to go to jail someday. . is there a place we can go?. is there anybody we can see?. maybe it's the same for you as it is for me. i ain't seen my family in twenty years. that ain't easy to understand, they may be dead by now. i lost track of em after they lost their land. . shake it up baby, twist and shout. you know what it's all about. what are you doing out there in the sun anyway?. don't you know, the sun can burn your brains right out. . my enemy crashed into the dust. stopped dead in his tracks and he lost his lust. he was run down hard and he broke apart. he died in shame, he had an iron heart. . i wear dark glasses to cover my eyes. there are secrets in em that i can't disguise. come back baby. if i hurt your feelings, i apologize. . two trains running side by side, forty miles wide. down the eastern line. you don't have to go. i just came to you because you're a friend of mine. . i think that when my back was turned. the whole world behind me burned. it's been a while. since we walked down that long, long aisle. . we cried on a cold and frosty morn. we cried because our souls were torn. so much for tears. so much for these long and wasted years",https://genius.com/Bob-dylan-long-and-wasted-years-lyrics,0.042,0.789,0.169,0.831,0.4365
Bob Dylan,Positively Van Gogh,The Bootleg Series,2015,"when i'd ask why the painting was deadly. nobody could pick up my sign. 'cept for the cook, she was always friendly. but she'd only ask, ""what's on your mind?"". she'd say that especially when it was raining. i'd say ""oh, i don't know"". but then she'd press and i'd say, ""you see that painting?. do you think it's been done by van gogh?"". . the cook she said call her maria. she'd always point for the same boy to come forth. saying, ""he trades cattle, it's his own idea. and he also makes trips to the north. have you ever seen his naked calf bleed?"". i'd say, ""oh no, why does it show?"". and she'd whisper in my ear that he's a half-breed. and i'd say, ""fine, but can he paint like van gogh?"". . i can't remember his name he never gave it. but i always figured he could go home. til when he'd gave me his card and said, ""save it"". i could see by his eyes he was alone. but it was sad how his four leaf clover. drawn on his calling card showed. that it was given back to him a-many times over. and it most definitely was not done by van gogh. . it was either she or the maid just to please me. though i sensed she could not understand. and she made a thing out of it by saying, ""go easy. he's a straight, but he's a very crooked straight man."". and i'd say, ""does the girl in the calendar doubt it?. and by the way is it marilyn monroe?"". but she'd just speak softly and say, ""why you wanna know about it?"". and i'd say, ""i was just wondering if she ever sat for van gogh."". . it was either her or the straight man who introduced me. to jeanette, camilla's friend. who later on falsely accused me of stealing her locket and pen. when i said ""i don't have the locket"". she said ""you steal pictures of everybody's mother i know"". and i said ""there's no locket. no picture of any mother i would pocket. unless it's been done by van gogh."". . camilla's house stood on the outskirts. how strange to see the chandeliers destroyed. while  beneath the velvet carpet. of fox hunts and love far before",https://genius.com/Bob-dylan-positively-van-gogh-lyrics,0.091,0.822,0.087,0.913,0.502
Bob Dylan,Moonshiner,The Bootleg Series,2005,i've been a moonshiner. for seventeen long years. i've spent all my money. on whiskey and beer. i go to some hollow. and sit at my still. and if whiskey dont kill me. then i dont know what will. . i go to some bar room. and drink with my friends. where the women can't follow. and see what i spend. god bless them pretty women. i wish they was mine. their breath is as sweet. the dew on the vine. . let me eat when i am hungry. let me drink when i am dry. a dollar when i am hard up. religion when i die. the whole world's a bottle. and life's but a dram. when the bottle gets empty. it sure ain't worth a damn,https://genius.com/Bob-dylan-moonshiner-lyrics,0.155,0.783,0.062,0.938,0.5465
Bob Dylan,Blind Willie McTell,The Bootleg Series,1991,"seen the arrow on the doorpost. saying, “this land is condemned. all the way from new orleans. to jerusalem”. i traveled through east texas. where many martyrs fell. and i know no one can sing the blues. like blind willie mctell. . well, i heard that hoot owl singing. as they were taking down the tents. the stars above the barren trees. were his only audience. them charcoal gypsy maidens. can strut their feathers well. but nobody can sing the blues. like blind willie mctell. . see them big plantations burning. hear the cracking of the whips. smell that sweet magnolia blooming. see the ghosts of slavery ships. i can hear them tribes a-moaning. hear that undertaker's bell. nobody can sing the blues. like blind willie mctell. . there's a woman by the river. with some fine young handsome man. he's dressed up like a squire. bootlegged whiskey in his hand. there's a chain gang on the highway. i can hear them rebels yell. and i know no one can sing the blues. like blind willie mctell. . well, god is in his heaven. and we all want what's his. but power and greed and corruptible seed. seem to be all that there is. i'm gazing out the window. of the st. james hotel. and i know no one can sing the blues. like blind willie mctell",https://genius.com/Bob-dylan-blind-willie-mctell-lyrics,0.175,0.686,0.14,0.86,0.5175
Bob Dylan,Last Thoughts on Woody Guthrie,The Bootleg Series,,"i have a poem here. it's not a poem, it's... this is the first concert i played alone in new york, really. an a fellow in brooklyn state hospital, his name is woody guthrie. but woody is more than a folk singer. he's really something else more than a folk singer and there's this book coming out that's dedicated to him. and they asked me to write something about woody, like what does woody mean to you in 25 words. and i couldn't do it, i wrote out 5 pages and i have it here. i have it here by accident actually. but i'd like to say this out loud. so this is my feelings towards woody guthrie. cannot really be told in how many records of his i buy, it's a lot more than that actually. so if you can roll along with this thing here this is called ""last thoughts on woody guthrie"". . when yer head gets twisted and yer mind grows numb. when you think you're too old, too young, too smart or too dumb. when yer laggin' behind an' losing yer pace. in a slow-motion crawl of life's busy race. no matter what yer doing if you start givin' up. if the wine don't come to the top of yer cup. if the wind's got you sideways with one hand holdin' on. and the other starts slipping and the feeling is gone. and yer train engine fire needs a new spark to catch it. and the wood's easy findin' but yer lazy to fetch it. and yer sidewalk starts curlin' and the street gets too long. and you start walkin' backwards though you know its wrong. and lonesome comes up as down goes the day. and tomorrow's morning seems so far away. and you feel the reins from yer pony are slippin'. and yer rope is a-slidin' cause yer hands are a-drippin'. and yer sun-decked desert and evergreen valleys. turn to broken down slums and trash-can alleys. and yer sky cries water and yer drain pipe's a-pourin'. and the lightnin's a-flashing and the thunder's a-crashin'. and the windows are rattlin' and breakin' and the roof tops a-shakin'. and yer whole world's a-slamming  and banging. and yer minutes of sun turn to hours of storm. and to yourself you sometimes say. ""i never knew it was gonna be this way. why didn't they tell me the day i was born"". and you start gettin' chills and yer jumping from sweat. and you're looking for something you ain't quite found yet. and yer knee-deep in the dark water with yer hands in the air. and the whole world's a-watching with a window peek stare. and yer good gal leaves and she's long gone a-flying. and yer heart feels sick like fish when they're frying. and yer jackhammer falls from yer hand to yer feet. and you need it badly but it lays on the street. and yer bell's bangin' loudly but you can't hear its beat. and you think yer ears might a been hurt. or yer eyes've turned filthy from the sight-blinding dirt. and you figured you failed in yesterdays rush. when you were faked out an' fooled while facing a four flush. and all the time you were holdin' three queens. and it's making you mad, it's makin' you mean. like in the middle of life magazine. bouncin' around a pinball machine. and there's something on yer mind you wanna be saying. that somebody someplace oughta be hearin'. but it's trapped on yer tongue and sealed in yer head. and it bothers you badly when you're laying in bed. and no matter how you try you just can't say it. and yer scared to yer soul you just might forget it. and yer eyes get swimmy from the tears in yer head. and yer pillows of feathers turn to blankets of lead. and the lion's mouth opens and yer staring at his teeth. and his jaws start closing with you underneath. and yer flat on your belly with yer hands tied behind. and you wish you'd never taken that last detour sign. and you say to yourself just what am i doing. on this road i'm walkin', on this trail i'm turnin'. on this curve i'm hanging. on this pathway i'm strolling, in the space i'm taking. in this air i'm inhaling. am i mixed up too much, am i mixed up too hard. why am i walking, where am i running. what am i saying, what am i knowing. on this guitar i'm playing, on this banjo i'm frailin'. on this mandolin i'm strumming, in the song i'm singin'. in the tune i'm humming, in the words i'm writin'. in the words that i'm thinking. in this ocean of hours i'm all the time drinkin'. who am i helping, what am i breaking. what am i giving, what am i taking. but you try with your whole soul best. never to think these thoughts and never to let. them kind of thoughts gain ground. or make yer heart pound. but then again you know when they're around. just waiting for a chance to slip and drop down. 'cause sometimes you hear'em when the night times comes creeping. and you fear that they might catch you a-sleeping. and you jump from yer bed, from yer last chapter of dreamin'. and you can't remember for the best of yer thinking. if that was you in the dream that was screaming. and you know that it's something special you're needin'. and you know that there's no drug that'll do for the healin'. and no liquor in the land to stop yer brain from bleeding. and you need something special. yeah, you need something special all right. you need a fast flying train on a tornado track. to shoot you someplace and shoot you back. you need a cyclone wind on a stream engine howler. that's been banging and booming and blowing forever. that knows yer troubles a hundred times over. you need a greyhound bus that don't bar no race. that won't laugh at yer looks. your voice or your face. and by any number of bets in the book. will be rolling long after the bubblegum craze. you need something to open up a new door. to show you something you seen before. but overlooked a hundred times or more. you need something to open your eyes. you need something to make it known. that it's you and no one else that owns. that spot that yer standing, that space that you're sitting. that the world ain't got you beat. that it ain't got you licked. it can't get you crazy no matter how many. times you might get kicked. you need something special all right. you need something special to give you hope. but hope's just a word. that maybe you said or maybe you heard. on some windy corner 'round a wide-angled curve. . but that's what you need man, and you need it bad. and yer trouble is you know it too good. 'cause you look an' you start getting the chills. . 'cause you can't find it on a dollar bill. and it ain't on macy's window sill. and it ain't on no rich kid's road map. and it ain't in no fat kid's fraternity house. and it ain't made in no hollywood wheat germ. and it ain't on that dimlit stage. with that half-wit comedian on it. ranting and raving and taking yer money. and you think it's funny. no you can't find it in no night club or no yacht club. and it ain't in the seats of a supper club. and sure as hell you're bound to tell. that no matter how hard you rub. you just ain't a-gonna find it on yer ticket stub. no, and it ain't in the rumors people're tellin' you. and it ain't in the pimple-lotion people are sellin' you. and it ain't in no cardboard-box house. or down any movie star's blouse. and you can't find it on the golf course. and uncle remus can't tell you and neither can santa claus. and it ain't in the cream puff hair-do or cotton candy clothes. and it ain't in the dime store dummies or bubblegum goons. and it ain't in the marshmallow noises of the chocolate cake voices. that come knockin' and tappin' in christmas wrappin'. sayin' ain't i pretty and ain't i cute and look at my skin. look at my skin shine, look at my skin glow. look at my skin laugh, look at my skin cry. when you can't even sense if they got any insides. these people so pretty in their ribbons and bows. no you'll not now or no other day. find it on the doorsteps made out-a paper mache. and inside it the people made of molasses. that every other day buy a new pair of sunglasses. and it ain't in the fifty-star generals and flipped-out phonies. who'd turn yuh in for a tenth of a penny. who breathe and burp and bend and crack. and before you can count from one to ten. do it all over again but this time behind yer back. my friend. the ones that wheel and deal and whirl and twirl. and play games with each other in their sand-box world. and you can't find it either in the no-talent fools. that run around gallant. and make all rules for the ones that got talent. and it ain't in the ones that ain't got any talent but think they do. and think they're foolin' you. the ones who jump on the wagon. just for a while cause they know it's in style. to get their kicks, get out of it quick. and make all kinds of money and chicks. and you yell to yourself and you throw down yer hat. sayin', ""christ do i gotta be like that. ain't there no one here that knows where i'm at. ain't there no one here that knows how i feel. good god almighty. that stuff ain't real"". no but that ain't yer game, it ain't yer race. you can't hear yer name, you can't see yer face. you gotta look some other place. and where do you look for this hope that yer seekin'. where do you look for this lamp that's a-burnin'. where do you look for this oil well gushin'. where do you look for this candle that's glowin'. where do you look for this hope that you know is there. and out there somewhere. and your feet can only walk down two kinds of roads. your eyes can only look through two kinds of windows. your nose can only smell two kinds of hallways. you can touch and twist. and turn two kinds of doorknobs. you can either go to the church of your choice. or you can go to brooklyn state hospital. you'll find god in the church of your choice. you'll find woody guthrie in brooklyn state hospital. . and though it's only my opinion. i may be right or wrong. you'll find them both. in the grand canyon. at sundown",https://genius.com/Bob-dylan-last-thoughts-on-woody-guthrie-annotated,0.084,0.809,0.107,0.893,0.4885
Bob Dylan,"Farewell, Angelina",The Bootleg Series,1991,"farewell angelina. the bells of the crown. are being stolen by bandits. i must follow the sound. the triangle tingles. the music play slow. but farewell angelina. the night is on fire. and i must go. . there is no use in talking. and there's no need for blame. there is nothing to prove. ev'rything still is the same. a table stands empty. by the edge of the stream. but farewell angelina. the sky's changing colours. and i must leave. . the jacks and the queens. they forsake the courtyard. fifty-two gypsies. now file past the guards. in the space where the deuce. and the ace once ran wild. farewell angelina. the sky is folding. i'll see you after a while. . see the cross-eyed pirates sitting. perched in the sun. shooting tin cans. with a sawed-off shotgun. and the corporals and neighbors. clap and cheer with each blast. farewell angelina. the sky it is trembling. and i must leave fast. . king kong, little elves. in the rooftoops they dance. valentino-type tangos. while the hero's clean hands. shut the eyes of the dead. not to embarrass anyone. farewell angelina. the sky is flooding over. and i must be gone. . the camouflaged parrot. he flutters from fear. when something he doesn't know about. suddenly appears. what cannot be imitated. perfect must die. farewell angelina. the sky's flooding over. and i must go where it is dry. . machine guns are roaring. puppets heave rocks. at misunderstood visions. and at the faces of clocks. call me any name you like. i will never deny it. but farewell angelina. the sky is erupting. and i must go where it's quiet",https://genius.com/Bob-dylan-farewell-angelina-lyrics,0.066,0.788,0.146,0.854,0.46
Bob Dylan,He Was a Friend of Mine,The Bootleg Series,1961,he was a friend of mine. he was a friend of mine. every time i think about him now. lord i just can't keep from crying. cause he was a friend of mine. . he died on the road. he died on the road. he never had enough money. to pay his room or board. and he was a friend of mine. . i stole away and cried. i stole away and cried. cause i never had too much money. and i never been quite satisfied. and he was a friend of mine. . he never done no wrong. he never done no wrong. a thousand miles from home. and he never harmed no one. and he was a friend of mine. . he was a friend of mine. he was a friend of mine. every time i hear his name. lord i just can't keep from crying. cause he was a friend of mine,https://genius.com/Bob-dylan-he-was-a-friend-of-mine-lyrics,0.272,0.634,0.094,0.906,0.589
Bob Dylan,Talkin' Bear Mountain Picnic Massacre Blues,The Bootleg Series,,"well, i saw it advertised one day. that the bear mountain picnic was coming my way. ""come along and take a trip. we'll bring you up there on a ship. bring the wife and family. bring the whole kids"". yippee. . well, i run right down and bought a ticket. to this thing called the bear mountain picnic. little did i realize. i was in for a pleasant, funny surprise. had nothing to do with picnic. didn't come close to a mountain. and i hate bears. . took the wife and kids down to the pier. there was six thousand people there. everybody had a ticket for the trip. ""oh well,"" i said ""it's a pretty big ship. besides, anyhow, the more the merrier"". . well, we all got on, and what do you think?. that big old boat started to sink. more people kept a-piling on. that old ship was a-going down. funny way to start a picnic. . well, i soon lost track of my kids and wife. so many people, i never saw in my life. that old ship was sinking down in the water. there was six thousand people trying to kill each other. dogs a-barking, cats a-screaming. women a-yelling, men a-flying, fists a-flying. paper flying, cops a-coming, me a-running. maybe we just better call off the picnic. . i got shoved down, got pushed around. all i remember was a moanin' sound. don't remember one thing more. all i remember is waking up on the shore. my arms and legs were broken. my feet were splintered. my head was cracked. i couldn't walk. i couldn't talk, smell, feel. couldn't see. didn't know where i was. i was bald. quite lucky to be alive though. . well, feeling like i just climbed out of my casket. i grabbed back hold of my picnic basket. took the wife and kids and started home. wishing i'd never got up that mornin'. . now, i don't care just what you do. if you want a have a picnic, that's up to you. but don't tell me about it, i don't want to hear it. you see, i just lost all my picnic spirit. stay in my kitchen, have my own picnic. have a picnic in the bathroom. . well, it don't seem to me quite so funny. what some people are going to do for money. there's a brand new gimmick every day. just to take somebody's money away. i think we ought to take some of these people. and put them on a boat, send them up to bear mountain. for a picnic",https://genius.com/Bob-dylan-talkin-bear-mountain-picnic-massacre-blues-lyrics,0.091,0.876,0.033,0.967,0.529
Bob Dylan,Series of Dreams,The Bootleg Series,,"i was thinking of a series of dreams. where nothing comes up to the top. everything stays down where it's wounded. and comes to a permanent stop. wasn't thinking of anything specific. like in a dream, when someone wakes up and screams. nothing too very scientific. just thinking of a series of dreams. . thinking of a series of dreams. where the time and the tempo fly. and there's no exit in any direction. 'cept the one that you can't see with your eyes. wasn't making any great connection. wasn't falling for any intricate scheme. nothing that would pass inspection. just thinking of a series of dreams. . dreams where the umbrella is folded. into the path you are hurled. and the cards are no good that you're holding. unless they're from another world. . in one, numbers were burning. in another, i witnessed a crime. in one, i was running, and in another. all i seemed to be doing was climb. wasn't looking for any special assistance. not going to any great extremes. i'd already gone the distance. just thinking of a series of dreams",https://genius.com/Bob-dylan-series-of-dreams-lyrics,0.187,0.745,0.069,0.931,0.559
