Artist,Title,Album,Year,Lyrics,Lyrics Link,pos,neu,neg,opp neg,final score
Neil Young,Field Of Opportunity,Comes a Time,1978,"i've been wrong before. and i'll be there again. i don't have any answers my friend. just this pile of old questions. my memory left me here. in the field of opportunity. it's plowing time again. i'm going back to my house. but i'm not going now. it's too early. to be leaving here, somehow. let me bore you with this story. ""how my lover let me down"". while i borrow seeds of sadness. from the ground. . in the field of opportunity. it's plowing time again. there ain't no way of telling. where these seeds will rise or when. i'll just wait around until springtime. and then, i'll find a friend. in the field of opportunity. it's plowing time again. . when i'm all done cultivating. i'll be rocking on the porch. trying to picture. you and where you are. and there'll be no hesitating. when cupid lights the torch. with those headlights coming down the hill. between the stars",https://genius.com/Neil-young-field-of-opportunity-lyrics,0.141,0.795,0.064,0.936,0.5385
Neil Young,Do You Know How To Use This Weapon?,Others,,"do you know how to use this weapon?. - not really. - that weapon will replace your tongue. you will learn to speak through it. and your poetry will now be written with blood. what is your name?. my name is nobody. - excuse me? - my name is exaybachay:. he who talks loud, saying nothing. he who talks--. i thought you said your name was nobody. i prefer to be called nobody",https://genius.com/Neil-young-do-you-know-how-to-use-this-weapon-lyrics,0.057,0.943,0,1,0.5285
Neil Young,Nobody's Story,Others,,"my blood is mixed. my mother was ungumpai picani, my father was habsoluca. this mixture was not respected; as a small boy i was often left to myself. so i spent many months stalking the elk people, to prove i would soon become a good hunter. one day finally, my elk relatives took pity on me, and a young elk gave his life to me. with only my knife, i took his life. as i was preparing to cut the meat white men came upon me, they were english soldiers. i cut one with my knife but they hit me on the head, with a rifle. all went black; my spirit seemed to leave me. i was then taken east, in a cage. i was taken to toronto, then philadelphia, and then to new york; and each time i arrived in another city, somehow the white man had moved all thier people there ahead of me. each new city contained the same white people as the last, and i could not understand how a whole city of people could be moved so quickly. eventually, i was taken on a ship across the great sea, over to england, and i was paraded before them like a captured animal, an exhibit. so i mimicked them, imitating their ways, hoping they might lose interest in this young savage, but their interest only grew. i was copying them so they placed me into the white mans school. it was there that i discovered, in a book, the words that william blake had written. they were powerful words and they spoke to me. so i made careful plans and eventually i escaped. once again i crossed the great ocean. i saw many sad things as i made my way back to the lands of my people. once they realized who i was, the stories of my adventures angered them. they called me a liar. xebachae-he who talks loud saying nothing. ridiculed by my own people, and i was left to wander the earth alone. i am nobody",https://genius.com/Neil-young-nobodys-story-lyrics,0.117,0.797,0.086,0.914,0.5155
Neil Young,Sugar Mountain,Decade,1968,oh to live on sugar mountain. with the barkers and the colored balloons. you can't be 20 on sugar mountain. though you're thinking that. you're leavin' there too soon. you're leavin' there too soon. . it's so noisy at the fair. but all your friends are there. and the candy floss you had. and your mother and your dad. . oh to live on sugar mountain. with the barkers and the colored balloons. you can't be 20 on sugar mountain. though you're thinking that. you're leavin' there too soon. you're leavin' there too soon. . there's a girl just down the aisle. oh to turn and see her smile. you can hear the words she wrote. as you read the hidden note. . oh to live on sugar mountain. with the barkers and the colored balloons. you can't be 20 on sugar mountain. though you're thinking that. you're leavin' there too soon. you're leavin' there too soon. . now you're underneath the stairs. and you're giving back some glares. to the people who you met. and it's your first cigarette. . oh to live on sugar mountain. with the barkers and the colored balloons. you can't be 20 on sugar mountain. though you're thinking that. you're leavin' there too soon. you're leavin' there too soon. . now you say you're leaving home. because you want to be alone. ain't it funny how you feel. when you're findin' out it's real?. . oh to live on sugar mountain. with the barkers and the colored balloons. you can't be 20 on sugar mountain. though you're thinking that. you're leavin' there too soon. you're leavin' there too soon. oh to live on sugar mountain. with the barkers and the colored balloons. you can't be 20 on sugar mountain. though you're thinking that. you're leavin' there too soon,https://genius.com/Neil-young-sugar-mountain-lyrics,0.044,0.932,0.023,0.977,0.5105
Neil Young,Like a Hurricane,Decade,1977,once i thought i saw you. in a crowded hazy bar. dancing on the light. from star to star. far across the moonbeam. i know that's who you are. i saw your brown eyes. turning once to fire. . you are like a hurricane. there's calm in your eye. and i'm getting blown away. to somewhere safer. where the feeling stays. i want to love you but. i'm getting blown away. . i am just a dreamer. but you are just a dream. you could have been. anyone to me. before that moment. you touched my lips. that perfect feeling. when time just slips. away between us. on our foggy trip. . you are like a hurricane. there's calm in your eye. and i'm getting blown away. to somewhere safer. where the feeling stays. i want to love you but. i'm getting blown away. . . you are just a dreamer. and i am just a dream. you could have been. anyone to me. before that moment. you touched my lips. that perfect feeling. when time just slips. away between us. on our foggy trip. . you are like a hurricane. there's calm in your eye. and i'm getting blown away. to somewhere safer. where the feeling stays. i want to love you but. i'm getting blown away,https://genius.com/Neil-young-like-a-hurricane-lyrics,0.28,0.713,0.007,0.993,0.6365
Neil Young,Campaigner,Decade,1977,"i am a lonely visitor. i came too late to cause a stir. though i campaigned all my life. towards that goal. i hardly slept the night you wept. our secret's safe and still well kept. . where even richard nixon has got soul. even richard nixon has got soul. . traffic cops are all color blind. people steal from their own kind. evening comes too early for a stroll. down neon streets the streaker streaks. the speaker speaks but the truth still leaks. . where even richard nixon has got soul. even richard nixon has got it, soul. . the podium rocks in the crowded waves. the speaker talks of the beautiful saves. that went down long before. he played this role. for the hotel queens and the magazines. test tube genes and slot machines. . where even richard nixon has got soul. even richard nixon has got it, soul. . hospitals have made him cry. but there's always a freeway in his eye. though his beach just got too crowded for a stroll. roads stretch out like healthy veins. and wild gift horses strain the reins. . where even richard nixon has got soul. even richard nixon has got soul. . i am a lonely visitor. i came too late to cause a stir. though i campaigned all my life. towards that goal",https://genius.com/Neil-young-campaigner-lyrics,0.126,0.804,0.071,0.929,0.5275
Neil Young,Love Is a Rose,Decade,1977,"love is a rose but you better not pick it. it only grows when it's on the vine. a handful of thorns and you'll know you've missed it. you lose your love when you say the word mine. . i want to see what's never been seen. i want to live that age old dream. come on lads we can go together. let's take the best right now. take the best right now. i wanna go to an old ho-down. long ago in a western town. pick me up but my feet are dragging. give me a lift and i'll hay your wagon. . love is a rose but you better not pick it. it only grows when it's on the vine. a handful of thorns and you'll know you've missed it. you lose your love when you say the word mine. mine, mine, mine. . love is a rose, love is a rose. love is a rose, love is a rose. love is a rose, love is a rose",https://genius.com/Neil-young-love-is-a-rose-lyrics,0.356,0.587,0.057,0.943,0.6495
Neil Young,I Am a Child,Decade,,"i am a child, i'll last a while. you can't conceive of the pleasure in my smile. you hold my hand rough up my hair. it's lots of fun to have you there. . god gave to you, now, you give to me. i'd like to know what you learned. the sky is blue and so is the sea. what is the color when black is burned?. what is the color?. . you are a man, you understand. you pick me up and you lay me down again. you make the rules you say what's fair. it's lots of fun to have you there. . . i am a child, i'll last a while. you can't conceive of the pleasure in my smile",https://genius.com/Neil-young-i-am-a-child-lyrics,0.224,0.776,0,1,0.612
Neil Young,Winterlong,Decade,1977,"i waited for you, winterlong. you seem to be where i belong. it's all illusion anyway. . if things should ever turn out wrong. and all the love we have is gone. it won't be easy on that day. . waiting to follow. through the dreamlight of your way. is not so easy for me now. . half the time has passed away (sha-la-la-la). things we thought of yesterday (sha-la-la-la). come back now, come back now, wow-ow. . waiting to follow. through the dreamlight of your way. is not so easy for me now. . half the time has passed away (sha-la-la-la). things we thought of yesterday (sha-la-la-la). come back now, come back now, wow-ow. . i waited for you winterlong. you seem to be where i belong",https://genius.com/Neil-young-winterlong-lyrics,0.033,0.886,0.081,0.919,0.476
Neil Young,Star of Bethlehem,Decade,1977,ain't it hard when you wake up in the morning. and you find out that those other days are gone?. all you have is memories of happiness lingering on. all your dreams and your lovers won't protect you. they're only passing through you in the end. they'll leave you stripped of all that they can get to. and wait for you to come back again. yet still a light is shining from that lamp on down the hall. maybe the star of bethlehem wasn't a star at all,https://genius.com/Neil-young-star-of-bethlehem-lyrics,0.117,0.848,0.036,0.964,0.5405
Neil Young,Deep Forbidden Lake,Decade,1977,"on the lake, the deep forbidden lake. the old boats go gliding by. and the leaves are falling from the trees. and landing on the logs and i. see the turtles heading for the bog. and falling off the log. they make the water splash and feeling no backlash. they climb the happy banks. on the boats, the old and creaky boats. the shoreline goes gliding by. and the wind that was a dying breeze. is making the banners fly. see the colors floating on the sky. the pride of the captain's eye. as he glides his slender craft inside. and opens up the door. on the coast, the long and tempting coast. the cards on the table lie. and a speech so eloquent in reach. was made by a passerby. passing by the way between here and left behind. and it ripples through the crowds. who run and cast their doubts. in the deep forbidden lake. yes, it echoes through the crowds. who run and cast their doubts. in the deep forbidden lake",https://genius.com/Neil-young-deep-forbidden-lake-lyrics,0.062,0.841,0.097,0.903,0.4825
Neil Young,Cocaine Eyes,Decade,,"haven't a day goes by. i don't burn a little bit of my soul. hasn't a day goes by. i don't burn a little bit of my soul. scored some friends along the way. did what i did, said what i had to say. and i'd do it all again if i had to today. when all is said and done. i'm the one. . it's a long hard road. when your friends start. to leave you behind. it's a long hard road. when you try to find peace of mind. some might go for poison. and some go for too much stuff. some just go to sleep at night. and forget to wake up. . cocaine eyes. can't hide your face. it's no surprise. you lose the race. again. . i'm the one, yeah. . cocaine eyes. it won't hide your face. it's no surprise. you lost the race. once again. my old friend",https://genius.com/Neil-young-cocaine-eyes-lyrics,0.137,0.748,0.115,0.885,0.511
Neil Young,Betty Lou's Got a New Pair of Shoes,Everybody's Rockin',1983,"betty lou got a new pair of shoes. betty lou got a new pair of shoes (whooo). betty lou got a new pair of shoes. betty lou got a new pair of shoes. betty lou ah-whoo, ah-whoo, ah-whoo. betty lou got a new pair of shoes. well she walked in the shoe-store, picked out a shoe. she tried on a twelve, but that wouldn't do. betty lou got a new pair of shoes. betty lou bought a new pair of shoes. betty lou ah-whoo, ah-whoo, ah-whoo. betty lou got a new pair of shoes. well, she cracked up over the solid fit. walkin' down the street with her brand new kit. well, she's walkin' down the street, she met an undertaker. he tried to burry her new shudebakers. well, she went to a rock 'n' roll party the other night. someone stepped on her shudebakers and she started a fight!. well, she walked in the shoe-store, gave the man a tip. she told him to go buy himself a rocketship",https://genius.com/Neil-young-betty-lous-got-a-new-pair-of-shoes-lyrics,0.125,0.875,0,1,0.5625
Neil Young,Payola Blues,Everybody's Rockin',1983,"this one's for you al freed. wherever you go, whatever you do. because the things they're doing today. will make a saint out of you. payola blues. i've got the payola blues. even though i already paid my dues. listen to me mr. d.j. hear what i've got to say. if a man is making music. they ought to let his record play. . payola blues. no matter where i go. i never hear my record on the radio. . well, here's three thousand. that ought to get it on. well, thanks a lot man!. i love your new song. . . i got a brand new record company. new manager too. got a great new record. i can't get through to you. . . how about this new mercedes benz. that ought to get it on. well, thanks a lot man!. i'll play it all day long. . . i've got the payola blues, payola blues. i'm paying those payola blues. no matter where i go. i never hear my record on the radio",https://genius.com/Neil-young-payola-blues-lyrics,0.176,0.798,0.025,0.975,0.5755
Neil Young,Kinda Fonda Wanda,Everybody's Rockin',1983,"well, i went with mary lou. tried peggy sue. had a date with donna. and barbara ann too. . but i'm kind of found of want to. kind of found of want to. yeah, i'm kind of found of want to. because want to always. want to want to want to. . well, i went out with jenny. took out skinny minnie. long tall sally. and short fat fanny. . . did the bop with miss ann. the swim with mary ann. the stroll with betty lou. screwed runaround sue. but she wasn't. as good as want to. no, she'll never be. as good as want to. i'm kind of found of want to. because want to always. want to want to want to. . kind of found of want to. yeah, i'm kind of found of want to. because wanda always. want to want to want to",https://genius.com/Neil-young-kinda-fonda-wanda-lyrics,0.227,0.681,0.092,0.908,0.5675
Neil Young,Rainin' in My Heart,Everybody's Rockin',1983,"rainin' in my heart. since we been apart. i know i was wrong. baby please come home. you got me cryin'. 'bout to lose my mind. don't let me cry in vain. try my love just once again. spoken:. honey, i need your love. darlin', you know why. if you would come back home. there'll be no need for me to cry. sings:. rainin' in my heart. since we been apart. i know i was wrong. baby please come home",https://genius.com/Neil-young-rainin-in-my-heart-lyrics,0.189,0.667,0.145,0.855,0.522
Neil Young,"Cry, Cry, Cry",Everybody's Rockin',1983,"cry, cry, cry, cry, cry, cry. cry, cry, cry, cry, cry, cry. cry, cry, cry, cry, cry, cry. . well, old man river just keeps on rolling. on down the line. like my tears just keep on flowing. all the time. can't you hear me cry. . . well, somewhere there's a rainbow for me. i know it's my time. i am getting so tired. of standing in this light. can't you hear me cry. . boo, hoo, hoo, boo, hoo, hoo. boo, hoo, hoo, boo, boo, hoo. boo, hoo, hoo, cry, cry, cry. boo, hoo, hoo, boo, hoo, hoo. cry, cry, cry, cry",https://genius.com/Neil-young-cry-cry-cry-lyrics,0.042,0.404,0.555,0.445,0.2435
Neil Young,Everybody's Rockin',Everybody's Rockin',1983,"when grandma and grandpa. get out on the floor. they rock until they drop. and then they rock some more. . yeah, everybody's rocking. well, everybody's rocking. everybody's rocking. rocking to the dancing beat. . from the shakey city. down to new orleans. the golden gate. to the bronx and queens. . . when ronnie and nancy. do the bop on the lawn. they're rocking in the white house. all night long. . . everybody's rocking. rocking their blues away. everybody's rocking. rockin' all night and day. . everybody's rocking. everybody's rocking. yeah, everybody's rocking. everybody's rocking. everybody's rocking. rocking to the dancing beat. everybody's rocking. dancing to the rocking beat",https://genius.com/Neil-young-everybodys-rockin-lyrics,0.065,0.916,0.019,0.981,0.523
Neil Young,Light A Candle,Fork in the Road,2009,"instead of cursing the darkness. light a candle for where we're going. there's something ahead, worth fighting for. . when the light of time is on us. you will see our moment come. and the living soul inside will carry on. . it's a chance to give new meaning to every move we make. in the cavern, in the cave, where we come from. . when the light of dawn is on us. we will see what we can be. and the ancient ones can sleep an easy sleep. in the hallways of the ages, on the road to history. what we do now will always be with us. . . instead of cursing the darkness. light a candle for where we're going. there's something ahead, worth looking for. . . light a candle in the darkness. so others might see ahead. light a candle in the darkness, when you go",https://genius.com/Neil-young-light-a-candle-lyrics,0.058,0.871,0.07,0.93,0.494
Neil Young,Fork In The Road,Fork in the Road,2009,got a pot belly. it's not too big. gets in my way. when i'm driving my rig. driving this country. in a big old rig. things i've seen. mean a lot. friend has a pickup. drives his kid to school. then he takes his wife. to beauty school. now she's doing nails. going get a job. got a good teacher. there's a fork in the road ahead. i don't know which way i'm going to turn. there's a fork in the road ahead. about this year. we salute the troops. they're all still there. in a fucking war. it's no good. whose idea was that?. i've got hope. but you can't eat hope. i'm not done. not giving up. not cashing in. too late. . there's a bailout coming but it's not for me. it's for all those creeps watching tickers on tv. there's a bailout coming but it's not for me. . i'm a big rock star. my sales have tanked. but i still got you. thanks. download this. sounds like shit. keep on blogging. until the power goes out. your battery's dead. twist and shout. on the radio. those were the days. bring them back. . there's a bailout coming but it's not for you. it's for all those creeps hiding what they do. there's a bailout coming but it's not for you. bailout coming but it's not for you. . got my flat screen. got it repo would now. they picked it up. left a hole in the wall. last saturday. missed the raider's game. . there's a bailout coming but it's not for you. it's for all those creeps hiding what they do,https://genius.com/Neil-young-fork-in-the-road-lyrics,0.081,0.795,0.123,0.877,0.479
Neil Young,Just Singing A Song,Fork in the Road,2009,you can play my guitar. see it where it will go. send this song to a distant star. while the rhythm explodes. just singing a song won't change the world. . you can ride in my car. see how it rolls. feel the new energy. as it quietly rolls. just singing a song won't change the world. you can sing about change. while you're making your own. you can be what you try to say. while the big wheel rolls. just singing a song won't change the world,https://genius.com/Neil-young-just-singing-a-song-lyrics,0.053,0.947,0,1,0.5265
Neil Young,Johnny Magic,Fork in the Road,2009,"johnny magic has a way with metal. has a way with machines. one day in a garage far away. he met destiny. in the form of a heavy metal continental. she was born to run on a proud highway. then the whole world started running out of money. people losing their jobs. right here in wichita. . wichita. the home of the heavy metal continental. where the motor-head messiah was tuning the system in. johnny magic, johnny magic. johnny magic, johnny magic. . she burst from the garage in a blaze of silence. disappearing down douglas at lightning speed. she was gone before the garage door was down. . . wichita. the home of the heavy metal continental. she was born to run on a proud highway. now she goes long range on domestic green fuel. 100 miles per gallon is the continental rule. out on the kansas two-lane flats near wichita. . . the motor-head messiah went to washington. to show them what he'd done. the senators and congressmen came down. in washington. and they rode in the heavy metal continental. she was born to run on a proud highway. johnny magic, johnny magic . wichita. the motor-head messiah was tuning the system in. wichita (repeats until fade)",https://genius.com/Neil-young-johnny-magic-lyrics,0.046,0.941,0.013,0.987,0.5165
Neil Young,Rockin' in the Free World (Electric),Freedom,1989,"there's colors on the street. red, white, and blue. people shuffling their feet. people sleeping in their shoes. there's a warning sign on the road ahead. there's a lot of people saying we'd be better off dead. don't feel like satan, but i am to them. so i try to forget it any way i can. . keep on rockin' in the free world. keep on rockin' in the free world. keep on rockin' in the free world. keep on rockin' in the free world. . i see a woman in the night. with a baby in her hand. there's an old street light. near a garbage can. now she put the kid away and she's gone to get a hit. she hates her life and what she's done to it. there's one more kid that'll never go to school. never get to fall in love, never get to be cool. . keep on rockin' in the free world. keep on rockin' in the free world. keep on rockin' in the free world. keep on rockin' in the free world. . . we got a thousand points of light. for the homeless man. we got a kinder, gentler machine gun hand. we've got department stores and toilet paper. got styrofoam boxes for the ozone layer. got a man of the people says keep hope alive. got fuel to burn, got roads to drive. . keep on rockin' in the free world. keep on rockin' in the free world. keep on rockin' in the free world. keep on rockin' in the free world. . . keep on rockin' in the free world",https://genius.com/Neil-young-rockin-in-the-free-world-electric-lyrics,0.284,0.674,0.043,0.957,0.6205
Neil Young,Too Far Gone,Freedom,1989,when i woke up you were gone. and the sun was on the lawn. empty pillow with perfume on. i smelled it. well we met in my favorite bar. took a ride in my old car. but i still don't know how. we made it home. . was i too far gone?. too far gone. too far gone for you. . we had drugs and we had booze. but we still had somethin' to lose. and by dawn i wanted to marry you. with our attitudes by day. and our secret dreams by night. can we really live our lives that way?. . am i too far gone?. too far gone. too far gone for you. was i too far gone?. too far gone. too far gone for you,https://genius.com/Neil-young-too-far-gone-lyrics,0.064,0.897,0.039,0.961,0.5125
Neil Young,Rockin' In The Free World (Live Acoustic),Freedom,1989,"there's colors on the street. red, white and blue. people shuffling their feet. people sleeping in their shoes. but there's a warning sign on the road ahead. there's a lot of people saying we'd be better off dead. don't feel like satan, but i am to them. so i try to forget it any way i can. . keep on rockin' in the free world. keep on rockin' in the free world. keep on rockin' in the free world. keep on rockin' in the free world. . i see a woman in the night. with a baby in her hand. under an old street light. near a garbage can. now she puts the kid away and she's gone to get a hit. she hates her life, and what she's done to it. there's one more kid that will never go to school. never get to fall in love, never get to be cool. . keep on rockin' in the free world. keep on rockin'  in the free world. keep on rockin' in the free world. keep on rockin' in the free world. . we got a thousand points of light. for the homeless man. we got a kinder, gentler machine gun hand. we got department stores and toilet paper. got styrofoam boxes for the ozone layer. got a man of the people, says keep hope alive. got fuel to burn, got roads to drive. . keep on rockin' in the free world. keep on rockin' in the free world. keep on rockin' in the free world. keep on rockin' in the free world",https://genius.com/Neil-young-rockin-in-the-free-world-live-acoustic-lyrics,0.272,0.663,0.065,0.935,0.6035
