Artist,Title,Album,Year,Lyrics,Lyrics Link,pos,neu,neg,opp neg,final score
Neil Young,Hitchhiker,Le Noise,2010,"when i was a hitchhiker on the road. i had to count on you. but you needed me to ease the load. and for conversation too. or did you just pass on through. you didn't see me in toronto. when i first tried out some hash. smoked through a pen and i'd do it again. but i didn't have the cash. i didn't have the cash. then i tried amphetamines. and my head was in a glass. taped underneath the speedometer wires. of my 48 buick's dash. but i knew that wouldn't last. then came california. where i first saw open water. in the land of opportunity. i knew i was getting hotter. i knew i was getting hotter. but the neon lights. and the endless nights. they took me by surprise. the doctor gave me valium. but i still couldn't close my eyes. i still couldn't close my eyes. then came paranoia. and it ran away with me. i couldn't sign my autograph. or appear on tv. or see or be seen. living in the country. looked good to me. smoking grass while the summer passed. in a real organic scene. where everything was green. then we had a kid and we split apart. i was living on the road. and a little cocaine went a long, long way. to ease that different load. and my head did explode. my head did explode. i thought i was an aztec. or a runner in peru. i would build such beautiful buildings. to house the chosen few. like an inca from peru. now many years have come and gone. like friends and enemies. i tried to leave my past behind. but it's catching up with me. it's catching up with me. i don't know how i'm standing here. living my life. i'm thankful for my children. and my faithful wife",https://genius.com/Neil-young-hitchhiker-lyrics,0.132,0.843,0.026,0.974,0.553
Neil Young,Love And War,Le Noise,2010,"when i sing about love and war. i don't really know what i'm saying. i've been in love and i've seen a lot of war. seen a lot of people praying. they pray to allah and they prey to the lord. but mostly they pray about love and war. pray about love and war. i've seen a lot of young men go to war. and leave a lot of young brides waiting. i've watched them try to explain it to their kids. and seen a lot of them failing. they tried to tell them and they tried to explain. why daddy won't ever come home again. daddy won't ever come home again. i said a lot of things that i can't take back. but i don't really know if i want to. there've been songs about love. i sang songs about war. since the backstreets of toronto. i sang for justice and i hit a bad chord. but i still try to sing about love and war. sing about love and war. the saddest thing in the whole wide world. is to break the heart of your lover. i made a mistake and i did it again. and we struggled to recover. then i sang in anger, hit another bad chord. but i still try to sing about love and war. i've been in love and i've seen a lot of war. seen a lot of people praying. they pray to allah and they prey to the lord. but mostly they pray about love and war. pray about love and war",https://genius.com/Neil-young-love-and-war-lyrics,0.241,0.519,0.241,0.759,0.5
Neil Young,Angry World,Le Noise,2010,some see life as a broken promise. some see life as an endless fight. they think they live in the age of darkness. they think they live in the age of light. it's an angry world. and everything is gonna be all right. yeah it's an angry world. yeah it's an angry world. some see life as hope eternal. some see life as a business plan. some will go to hell's inferno. for screwing up their life in freedom land. it's an angry world. for the business man and the fisher man. it's an angry world. and no doubt everything will go as planned. yeah it's an angry world. yeah it's an angry world,https://genius.com/Neil-young-angry-world-lyrics,0.123,0.623,0.253,0.747,0.435
Neil Young,Walk With Me,Le Noise,2010,i feel your love. i feel your strong love. i feel the patience among conditional love. i feel a strength. i feel your faith in me. i'll never let you down no matter what you do. if you just walk with me and let me walk with you. i'm on this journey i don't wanna walk alone. walk with me. walk with me. shine me a light. walk with me. i lost some people i was traveling with. i missed a soul in the old friendship,https://genius.com/Neil-young-walk-with-me-lyrics,0.287,0.644,0.07,0.93,0.6085
Neil Young,Sign Of Love,Le Noise,2010,"when we go for a little walk. out on the land. when we're just walking and holding hands. you can take it as a sign of love. when the winds of fate. keep blowing and we both understand. . sign of love. it's a sign of love. sign of love. . when we both have silver hair. and a little less time. but there still are roses on the vine. you can take it as a sign of love. when i look at you. when i'm looking at you for a long, long time. . . when i first saw you. you were just a girl. and i was a man. while the music played. i watched you dance",https://genius.com/Neil-young-sign-of-love-lyrics,0.166,0.834,0,1,0.583
Neil Young,Peaceful Valley Boulevard,Le Noise,2010,"one day shots rang across the peaceful valley. god was crying tears that fell like rain. before the railroad came from kansas city. and the bullets hit the bison from the train. first shots rang across the peaceful valley. and the white man laid his foot upon the plain. the wagon train rolled through the dusty canyon. the settlers full of wonder as they crossed. a gentle creek where two old oaks were standing. before the west was won there was a cost. a rain of fire came down upon the wagons. a mother screamed and every soul was lost. change hit the country like a thunderstorm. ancient rivers soon began to boil. people rushed like water to california. at first they came for gold and then for oil. fortunes were made and lost in lifetimes. mother earth took poison in her soil. an electra cruiser coasted towards the exit. and turned on peaceful valley boulevard. ""people make the difference"" read a billboard. above a long line of idling cars. who'll be the one to lead this world. who'll be the beacon in the night. who'll be the one to lead this world. who'll be the beacon in the night. who'll be the one to lead the nations. and protect god's creations. a polar bear was drifting on an ice floe. sun beating down from the sky. politicians gathered for a summit. and came away with nothing to decide. storms thundered on, his tears of falling rain. a child was born and wondered why",https://genius.com/Neil-young-peaceful-valley-boulevard-lyrics,0.111,0.801,0.087,0.913,0.512
Neil Young,Someone's Gonna Rescue You,Le Noise,2010,"somewhere in the rays of sunshine, you find the dark. somehow when you see the spark, it burns your heart. someone's gonna rescue you and bring you back. i see you standing there, i hear you call. and when you look at me, you don't see it all. someone's gonna rescue you before you fall. no one can do the things you do. someone can save you. you're scared of the way it goes sometimes in the night. when it gets the best of you, you put up a fight. someone's gonna rescue you and make it right. someone's gonna rescue you",https://genius.com/Neil-young-someones-gonna-rescue-you-lyrics,0.212,0.725,0.063,0.937,0.5745
Neil Young,Rumblin',Le Noise,2010,"i feel the rumbling in her ground. i feel the rumbling. i feel the rumbling in her ground. i feel the rumbling. . when will i learn how to listen?. when will i learn how to feel?. when will i learn how to give back?. when will i learn how to heal?. i can feel the weather changing. i can see it all around, all around. can't you feel that new wind blowing?. don't you recognize that sound that sound, that sound?. and the earth is slowly spinning, spinning slowly, slowly changing. i feel something in the air. . . when will i learn?. when will i learn how to give back?. when will i learn how to heal?",https://genius.com/Neil-young-rumblin-lyrics,0,1,0,1,0.5
Neil Young,America The Beautiful,Living with War,2006,o beautiful for spacious skies. for amber waves of grain. for purple mountain majesties. above the fruited plain!. america! america!. god shed his grace on thee. and crown thy good with brotherhood. from sea to shining sea!,https://genius.com/Neil-young-america-the-beautiful-lyrics,0.287,0.713,0,1,0.6435
Neil Young,Let's Impeach the President,Living with War,2006,let's impeach the president for lying. and misleading our country into war. abusing all the power that we gave him. and shipping all our money out the door. he's the man who hired all the criminals. the white house shadows who hide behind closed doors. they bend the facts to fit with their new stories. of why we have to send our men to war. let's impeach the president for spying. on citizens inside their own homes. breaking every law in the country. by tapping our computers and telephones. what if al qaeda blew up the levees. would new orleans have been safer that way. sheltered by our government's protection. or was someone just not home that day?. flip - flop. flip - flop. flip - flop. flip - flop. let's impeach the president for hijacking. our religion and using it to get elected. dividing our country into colors. and still leaving black people neglected. thank god he's cracking down on steroids. since he sold his old baseball team. there's lots of people looking at big trouble. but of course our president is clean. thank god,https://genius.com/Neil-young-lets-impeach-the-president-lyrics,0.08,0.795,0.125,0.875,0.4775
Neil Young,Living With War,Living with War,2006,"i'm living with war everyday. i'm living with war in my heart everyday. i'm living with war right now. . and when the dawn breaks i see my fellow man. and on the flat-screen we kill and we're killed again. and when the night falls, i pray for peace. try to remember peace (visualize). i join the multitudes. i raise my hand in peace. i never bow to the laws of the thought police. i take a holy vow. to never kill again. to never kill again. . i'm living with war in my heart. i'm living with war in my heart in my mind. i'm living with war right now. . don't take no tidal wave. don't take no mass grave. don't take no smoking gun. to show how the west was won. but when the curtain falls, i pray for peace. try to remember peace. in the crowded streets. in the big hotels. in the mosques and the doors of the old museum. i take a holy vow. to never kill again. try to remember peace. . the rocket's red glare. bombs bursting in air. give proof through the night. that our flag is still there. . i'm living with war everyday. i'm living with war in my heart everyday. i'm living with what right now",https://genius.com/Neil-young-living-with-war-lyrics,0.14,0.678,0.182,0.818,0.479
Neil Young,After The Garden,Living with War,2006,won't need no shadow man. runnin' the government. won't need no stinkin' war. won't need no haircut. won't need no shoe shine. . after the garden is gone. after the garden is gone. after the garden is gone. what will people do. after the garden is gone?. what will people say. after the garden?. . won't need no strong man. walkin' through the night. to live a weak man's day. won't need no purple haze. won't need no sunshine. . after the garden is gone. after the garden is gone. after the garden is gone. where will people go. after the garden is gone?. what will people know. after the garden?. . after the garden is gone. after the garden is gone. after the garden is gone. after the garden is gone. after the garden is gone,https://genius.com/Neil-young-after-the-garden-lyrics,0.096,0.821,0.082,0.918,0.507
Neil Young,Shock and Awe,Living with War,2006,"back in the days of shock and awe. we came to liberate them all. history was the cruel judge of overconfidence. back in the days of shock and awe. back in the days of ""mission accomplished"". our chief was landing on the deck. the sun was setting on a golden photo op. back in the days of ""mission accomplished"". thousands of bodies in the ground. brought home in boxes to a trumpet's sound. no one sees them coming home that way. thousands buried in the ground. thousands of children scarred for life. millions of tears for a soldier's wife. both sides are losing now. heaven takes them in. thousands of children scarred for life. we had a chance to change our mind. but somehow wisdom was hard to find. we went with what we knew and now we can't go back. but we had a chance to change our mind",https://genius.com/Neil-young-shock-and-awe-lyrics,0.068,0.852,0.079,0.921,0.4945
Neil Young,Roger And Out,Living with War,2006,trippin' down that old hippie highway. got to thinkin' 'bout you again. wonderin' how it really was for you. and how it happened in the end. but i guess i'll never know the truth. if you were really all alone. we were just a couple'a kids then. livin' each and every day. when we both went down to register. we were laughin' all the way. that's when we named it the hippie highway. i still call it that today. roger and out good buddy. i still call it that today. two camaros racing down the road. feels just like yesterday. roger and out good buddy. i feel you in the air today. i know you gave for your country. i feel you in the air today. roger and out good buddy,https://genius.com/Neil-young-roger-and-out-lyrics,0.107,0.854,0.039,0.961,0.534
Neil Young,Lookin' For A Leader,Living with War,2006,looking for a leader. to bring our country home. re-unite the red white and blue. before it turns to stone. looking for somebody. young enough to take it on. clean up the corruption. and make the country strong. walking among our people. there's someone who's straight and strong. to lead us from desolation. and a broken world gone wrong. someone walks among us. and i hope he hears the call. and maybe it's a woman. or a black man after all. yeah maybe it's obama. but he thinks that he's too young. maybe it's colin powell. to right what he's done wrong. america has a leader. but he's not in the house. he's waling here among us. and we've got to seek him out. yeah we've got our election. but corruption has a chance. we got to have a clean win. to regain confidence. america is beautiful. but she has an ugly side. we're looking for a leader. in this country far and wide. we're looking for a leader. with the great spirit on his side. someone walks among us. and i hope he hears the call. and maybe it's a woman. or a black man after all,https://genius.com/Neil-young-lookin-for-a-leader-lyrics,0.207,0.737,0.056,0.944,0.5755
Neil Young,The Restless Consumer,Living with War,2006,"the people have heard the news. the people have spoken. you may not like what they said. but they weren't joking. way out on the desert sands. lies a desperate lover. they call her the ""queen of oil"". so much to discover. don't need no ad machine. telling me what i need. don't need no madison avenue war. don't need no more boxes i can see. covered in flags but i can't see them on tv. . don't need no more lies . . the restless consumer flies. around the world each day. with such an appetite for taste and grace. people from around the world. need someone to listen. we're starving and dying from our disease. we need your medicine. how do you pay for war. and leave us dying?. when you could do so much more. you're not even trying. don't need no tv ad. telling me how sick i am. don't want to know how many people are like me. don't need no dizziness. don't need no nausea. don't need no side effects like diarrhea or sexual death. . don't need no more lies. . the restless consumer lies. asleep in her hotel. with such an appetite. for anything that sells. a hundred voices from a hundred lands. need someone to listen. people are dying here and there. they don't see the world the way you do. there's no mission accomplished here. just death to thousands. a hundred voices from a hundred lands. cry out in unison. don't need no terror squad. don't want no damned jihad. blowing themselves away in my hood. but we don't talk to them. so we don't learn from them. hate don't negotiate with good. . . the restless consumer flies. around the world each day. with such an appetite for efficiency. and pace",https://genius.com/Neil-young-the-restless-consumer-lyrics,0.134,0.645,0.221,0.779,0.4565
Neil Young,Flags Of Freedom,Living with War,2006,today's the day our younger son. is going off to war. fighting in the age old battle. we've sometimes won before. flags that line old main street. are blowing in the wind. these must be the flags of freedom flying. . church bells are ringing. as the families stand and wave. some of them are crying. but the soldiers look so brave. looking straight ahead. like they know just where they're going. past the flags of freedom flyin'. sister has her headphones on. she hears the music blasting. she sees her brother marchin' by. their bond is everlasting. listening to bob dylan singing in 1963. watching the flags of freedom flying. she sees the president speaking. on a flat-screen tv. in the window of the old appliance store. she turns to see her brother again. but he's already walking past. the flags of freedom flying. have you seen the flags of freedom?. what color are they now?. do you think that you believe in yours. more than they do theirs somehow?. when you see the flags of freedom flying,https://genius.com/Neil-young-flags-of-freedom-lyrics,0.191,0.771,0.038,0.962,0.5765
Neil Young,Families,Living with War,2006,when you try to bring our spirit home. won't you celebrate our lives. in a way that's right for our children. and families. when you write your songs about us. won't you try to do us justice. because we want to be just like you. and your families. i see a light ahead. there's a chill wind blowing in my head. i wish that i was home instead. with my family. there's a universe between us now. but i want to reach our and tell you how. much you mean to me. and my family. i'm going back to the usa. i just got my ticket today. i can't wait to see you again. in the usa,https://genius.com/Neil-young-families-lyrics,0.097,0.885,0.018,0.982,0.5395
Neil Young,This Note's For You,Lucky Thirteen,1988,"ain't singing for pepsi. ain't singing for coke. i don't sing for nobody. makes me look like a joke. this note's for you. [verse. not singing for miller. don't sing for bud. i won't sing for politicians. ain't singing for spuds. this note's for you. . don't want no cash. don't need no money. ain't got no stash. this note's for you. . i've got the real thing. i got the real thing, baby. i got the real thing. yeah, alright",https://genius.com/Neil-young-this-notes-for-you-lyrics,0.178,0.807,0.015,0.985,0.5815
Neil Young,Don't Take Your Love Away From Me,Lucky Thirteen,,"there's just one thing. i'm asking of you. there's just one thing. baby, i'm asking of you. don't ever leave me, baby. no matter what you do. there's just one thing. i'm asking of you. . don't take your love away from me. cause if you ever leave me, baby. how wrong you would be. don't take your love away from me. when i make a promise. you can bet that it's true. when i make a promise. baby, you can bet that it's true. so put your chips down, baby. empty your pockets, too. cause when i make a promise. you can bet that it's true",https://genius.com/Neil-young-dont-take-your-love-away-from-me-lyrics,0.158,0.726,0.117,0.883,0.5205
Neil Young,Depression Blues,Lucky Thirteen,,got a woman that loves me. and i love her so. but she's all dressed up now. with nowhere to go. all our old hang-outs. are boarded up and closed. or being bought by somebody. nobody knows. but things are not that bad. we still got the kids. we're going out to the movies. right after this. going back to school. saving up my tuition. going to rewrite all the rules. on the old blackboard. cause it seems things today. there is no magic in them. they don't cut the grade. like they used to. . depression blues. nowhere to go. being bought by somebody. nobody knows. . is there anybody out there. with a voice loud and clear. gonna sing all the words. we all want to hear,https://genius.com/Neil-young-depression-blues-lyrics,0.124,0.82,0.056,0.944,0.534
Neil Young,Ain't It The Truth,Lucky Thirteen,,"it is not the truth. it is not the truth, now, baby. it is not the truth, now. what i say?. . eat watermelon. eat peaches and cream. eat ripe tomatoes. you know what i mean. . . your majesty. your curvaceousness. your highness. your soulfulness. . make love to me, babe. make love to me. make me feel all right, now. make me feel so good",https://genius.com/Neil-young-aint-it-the-truth-lyrics,0.166,0.753,0.081,0.919,0.5425
Neil Young,I'm The Ocean,Mirror Ball,1995,i'm an accident. i was driving way too fast. couldn't stop though. so i let the moment last. i'm for rolling. i'm for tossing in my sleep. it's not guilt though. it's not the company i keep. people my age. they don't do the things i do. they go somewhere. while i run away with you. i got my friends. and i got my children too. i got her love. she's got my love too. i can't hear you. but i feel the things you say. i can't see you. but i see what's in my way. now i'm floating. cause i'm not tied. to the ground. words i've spoken. seem to leave a hollow sound. on the long plain. see the rider in the night. see the chieftain. see the braves. in cool moonlight. who will love them. when they take another life. who will hold them. when they tremble. for the knife. voice mail numbers. on an old computer screen. rows of lovers. parked forever in a dream. screaming sirens. echoing across the bay. to the old boats. from the city far away. homeless heroes. walk the streets. of their hometown. rows of zeros. on a field. that's turning brown. they play baseball. they play football. under lights. they play card games. and we watch them every night. need distraction. need romance and candlelight. need random violence. need entertainment tonight. need the evidence. want the testimony of. expert witnesses. on the brutal crimes of love. i was too tired. to see the news. when i got home. pulled the curtain. fell into bed alone. started dreaming. saw the rider once again. in the doorway. where she stood. and watched for him. watched for him. i'm not present. i'm a drug. that makes you dream. i'm an aerostar. i'm a cutlass supreme. in the wrong lane. trying to turn. against the flow. . i'm the ocean. i'm the giant undertow. i'm the ocean. i'm the ocean. i'm the giant undertow. i'm the ocean. i'm the giant undertow. i'm the ocean,https://genius.com/Neil-young-im-the-ocean-lyrics,0.17,0.742,0.088,0.912,0.541
Neil Young,Song X,Mirror Ball,1995,hey ho away we go. we're on the road to never. where life's a joy. for girls and boys. and only will get better. hey ho away we go. we're on the road to never. romeo and juliet. the doctor and his case. without a plan they left the van. and there were laid to waste. hey ho away we go. we're on the road to never. the priest was there. with sandy hair. religion by his side. he saw his law was broken. the punishment was applied. hey ho away we go. along the road to never. hey ho away we go. we're on the road to never. . he held her hand. and wished her well. although his heart was aching. the cameras rolled. the print was bold. the holy war was breaking. it's hey ho away we go. we're on the road to never. where life's a joy. for girls and boys. and only will get better. hey ho away we go. along the road to never. hey ho away we go. we're on the road to never. hey ho away we go. along the road to never. hey ho away we go. we're on the road to never. . the priest was there. with sandy hair. religion by his side. he saw his law was broken. the punishment was applied,https://genius.com/Neil-young-song-x-lyrics,0.055,0.829,0.116,0.884,0.4695
Neil Young,Act Of Love,Mirror Ball,1995,the fruit of love was in the future. around the corner and over the hill. the act of love was slowly pounding. slowly pounding. slowly pounding. the holy war was slowly building. heroes leaving for the great crusade. seek reward in the ever after. ever after. ever after. don't wanna have to lose you baby. don't want to have to take you back. you know i'll never lose you baby. abuse you baby. use you baby. you know i'll always help you baby. but i just can't do that. i know i said i'd help you baby. here's my wallet. call me sometime. act of love. act of love. act of love. act of love. the fruit of love was in the future. around the corner and over the hill. the act of love was slowly pounding. slowly pounding. slowly pounding. act of love. act of love. act of love. act of love,https://genius.com/Neil-young-act-of-love-lyrics,0.354,0.6,0.046,0.954,0.654
Neil Young,Scenery,Mirror Ball,1995,looking at the grave. at the scenery around you. home of the brave. sometimes they leave you. like they found you. sometimes they worship you. sometimes they. tear your houses down. sometimes they comfort you. sometimes they. spread your life around. . nothing you can see. that they. won't try to give you. land of the free. where the legend. will outlive you. when you earn their trust. when you are truly in danger. where greed and lust. have never been a stranger. home of the brave. that's where. heroes need protection. media image slaves. live by random selection. you sell your heart. but that's not. the price of freedom. where things are useful. only when you need them. where will you go. when you need. to make some changes. who will you love. in a world. of constant strangers. i'll go with you. if you want. to take a hero home. i'll stay behind. if you want. to take a hero home. . . home of the brave,https://genius.com/Neil-young-scenery-lyrics,0.255,0.71,0.035,0.965,0.61
