Artist,Title,Album,Year,Lyrics,Lyrics Link,pos,neu,neg,opp neg,final score
Talking Heads,Mr. Jones,Naked,1988,"mr. jones. put a wiggle in your stride. loosen up. i believe he'll be alright. changing clothes. now he's got ventilated slacks. bouncing off the walls. mr. jones is back!. bulge out. and wind your waist. tight pants. got curly hair. drinking cold beer. from metal cans. moonshine. and handi-wipes!. mr. jones is back in town. it's his lucky day. hold up your hands and shout. jones is on his way. pitter pat. mr. jones is back in town. aces high. now his pants are falling down. he looks so fine. in those patent leather shoes. mr. jones, you look tired. i believe you'll be alright. sales men. conventioneers. some rock stars. with tambourines. short skirts. and skinny legs. selling bibles. and real estate. it's a big day for mr. jones. he is not so square. mr. jones will stick around. he's everybody's friend. fast cars. and motorbikes. i'm sure glad. he's on our side. the jones gang. down at the bar. watch out, this time. they've gone too far. they call for mr. jones. they put him in charge. mr. jones will help us out. he's a lucky guy. it is mr. jones' birthday party. for another year. in his hotel room party favors. it's a holiday",https://genius.com/Talking-heads-mr-jones-lyrics,0.15,0.83,0.02,0.98,0.565
Talking Heads,The Facts Of Life,Naked,1988,"monkey see and monkey do. making babies, eating food. smelly things, pubic hair. words of love in the air. sparks fly, shooting out. making sure that everything is working. i can't turn you down. we are programmed happy little children. matter over mind. we can not resist so i won't fight it. love is a machine. love is a machine without a driver. . the facts of life. . a masterpiece, biology. smoky water, air conditioned. boys 'n' girls and automation. chromosomes, designer jeans. and chimpanzees and human beings. . machines of love. . strong in body, strong in mind. a love machine with the facts of life. the facts of life, the facts of life. so much sex 'n' violence must be a bad design. we're stupid to be fighting, every night. the monsters we create they welcome us aboard. the best in advertising from coast to coast. the girls and boys combine like monkeys in the zoo. the clouds have silver linings looks pretty good. people fall in love like in fairy tales. i'm not sure i like, what they can do. i'm afraid that god has no master plan. he only takes what he can use. factory life, ice cream and pie. factory life. someday we'll live on venus, men will walk on mars. but we will still be monkeys down deep inside. if chimpanzees are smart then we will close our eyes. and let our instincts guide us, oh oh oh oh no",https://genius.com/Talking-heads-the-facts-of-life-lyrics,0.192,0.759,0.049,0.951,0.5715
Talking Heads,Cool Water,Naked,1988,"day by day. whistle while you work. our backs are breaking. up from hollow earth. from end to end. the noise begins. in the human battle stations. and the big one's coming in. work, work, work, work. work 'til holes are filled. work, work, work, work. bags of bone and skin. lovers hold hands. tossing their heads. tangled in hair. tied to earth. with skin and glue. but their skin is the same as yours. coming in for the world to see. they can sit at the table, too. the same blood as you and me. speak very softly. hold my hand. someone is sleeping. in my bed. priests pass by. worms crawl in. one dreams to be. one dream for all. his skin is the same as yours. is he not made the same as you?. and some have fallen down. and blood spilled on the ground. work, work, work. 'til his life is done. the old man. is at our door. and he's knocking. knocking. as his neighbors weep. each day repeats. are we nothing in your eyes?. someone answer, someone answer. this rusted garden gate. can barely even stand. their work is over now. and rest will be at hand. is their skin not the same as yours?. can they sit at the table to drink cool water?. cool water. and his lungs are filled with rain. and the water's rushing in",https://genius.com/Talking-heads-cool-water-lyrics,0.092,0.865,0.043,0.957,0.5245
Talking Heads,The Democratic Circus,Naked,1988,"found out this morning. there's a circus coming to town. they drive in cadillacs. using walkie-talkies, and the secret service. their big top. imitation of life. and all the flags and microphones. we have to cover our eyes. we play the sideshows. and we like the tunnel of love. and when we ride the ferris wheel. we're little children again. and when they're asking for volunteers. we'll be the first ones aboard. and when the ringmaster calls our names. we'll be the first ones to go ... to sleep. stealing all our dreams. dreams for sale. they sell 'em back to you. on with the show. start the parade. we sand along. sweep us away. it's political party time. going down, going down. and the celebrities all come out. coming down, coming down, coming. the sun is going down. and the dogs are starting to howl. we stay out after dark. eating cotton candy. and the music's playing. how we all laughed!. we split our sides. the cameras flashed. we almost died!. the rain's gonna pour on down, falling out of the sky. coming down, coming down. and the celebrities all run out, and the rain's. coming down, coming down. . gonna rain. gonna rain, gonna rain. rain, rain. . and now i wonder who's boss. and who he's leavin' behind?",https://genius.com/Talking-heads-the-democratic-circus-lyrics,0.096,0.881,0.023,0.977,0.5365
Talking Heads,Mommy Daddy You and I,Naked,1988,"all the way home from baltimore we couldn't find a seat. conductor says he's sorry for the blisters on our feet. . comes a-riding in a bus, the high and the low. mommy, daddy, you and i. going on a trip and we're not going home. mommy, daddy, you and i, i. . driving, keep driving, driving, driving all night. sleeping on my daddy's shoulder, drinking from a paper cup. and i'm wearing my grandfather's clothes and they say that up north it gets cold. . crawling out of bed one night, walking in my sleep. we're not the only family to take this little trip. . driving all the way up, it's 30 below. mommy, daddy, you and i. even little kids getting ready to go. mommy, daddy,you and i. . chilly, chilly-willy, it's colder the further we go. some are born to take advantage but saying it don't make it so. so hold me and don't let me go, 'cause the sidewalks are covered with snow. . he's speaking english now and he's smoothing out his clothes. he's mr. button down, he's leaving home. . making changes day by day and we still ain't got no plan. how we gonna make our way in this foreign land?. . well we'll keep driving, keep driving, driving with all of our might. changing, still changing, changing the water of life. keep that little man a shining, see how the tail can wag the dog. . and we're all riding in this old bus. and the driver is singing to us. and we're wearing our grandfather's clothes. 'cause we heard that up north it gets cold",https://genius.com/Talking-heads-mommy-daddy-you-and-i-lyrics,0.03,0.955,0.015,0.985,0.5075
Talking Heads,Big Daddy,Naked,1988,"she had such tiny tears. just like a barbie doll. she likes to shop at sears. and visit shopping malls. now she's a big mamma. tell poppa. . cry, cry, cry, cry. . old money. your old money doesn't matter now. have mercy. mercy, mercy, daddy's going fishing now. he put the bait onto his line. he's winding out his reel. fish are swimming in the pond. gonna let 'em sail away. he's got his eye on you. he knows just what she wants. the fish is gonna bite. she is his latest catch. cause he's big daddy. oh, mammy. . . big daddy. oh, daddy's scraping bottom now. oh, momma. daddy, daddy, daddy does the talking now. mesmerized like horny toads. by shiny things like jewels and gold. throwing all their pearls to swine. let 'em sail away. you lucky dog. you'll be on easy street. drinking champagne. she gets all that she wants. his heart's desire. no more worries anymore. like a fairy tale. anything that she likes. i seen you do the dog. i seen you getting down. a swimming back and forth. when daddy's not around. big daddy. oh, she's pretty as a picture now. oh, momma. oh, what a little martyr now. he knows how to drive 'em wild. one day you'd think she'd see. saying ""this is mine and this is her. now take that stuff away. it's best left unspoken. one and one is two. the velvet lies sing softly. each with a golden spoon. and she passed her time in the wind and the rain. got a one way ticket on a southbound train. said baby, baby, wants to have a good time. and big daddy laughed. and big daddy smiled. like dynamite. one fine day she'll explode. who's laughing now?. no one sees anymore. sneak in and out. don't get caught running 'round. swim back and forth. bubbles float to the top",https://genius.com/Talking-heads-big-daddy-lyrics,0.179,0.75,0.071,0.929,0.554
Talking Heads,Ruby Dear,Naked,1988,'round and 'round. and we won't let go. and where we stop. no one knows. uh-huh uh-huh. . down and down. in a spin we turn. looking like. we'll never learn. uh-huh uh-huh. think about. what ev'ryone is saying. ruby dear. oh don't you hear. late at night. when the radio is playing. ruby dear. so looky here. oh this record's broken. it slips a beat. and all those watermelons. have gone to seed. nothing lives. in this dirty little river. no one here. will shed a tear. it dried up. but it couldn't run forever. ruby dear. that's what we hear. i still like the ocean. down by the sea. they left that door wide open. it tempted me. hounding me. from the bedroom to the kitchen. ruby dear. i'm still right here. now they throwed. the fox amongst the chickens. it's too deep. i'll drown in my sleep!. angels and prostitutes. they might look the same. and if to hell we're going. i'll see you there. . . down the street. where the bonfires glow. looking like. they lost control. uh-huh uh-huh. settle down. in that rocking chair. breathing in. that rotten air. uh-huh uh-huh. johnny jones. fell fast asleep. down a hole. where the rocks are steep. uh-huh uh-huh,https://genius.com/Talking-heads-ruby-dear-lyrics,0.085,0.795,0.12,0.88,0.4825
Talking Heads,Bill,Naked,1988,"bill was a man. who grew too big. it didn't matter what he did. the girls would always run away. when everybody laughs at you. it can be humiliating. billy likes a. cute little girl. they are lovers. we can tell. kisses on the mouth. holding hands 'n' all. look into their eyes.... sneaking off together. running to the woods. swimming in the river. cooking up some food. making up religions. dropping out of school. laughing through the summertime. never meant to hurt nobody. angel of god. take me along. happy days. quiet life. we are not alone.... he bought a gun. and she fixed her dress. ""i'm not afraid of jesus christ. who cares about the price we pay"". it's our little secret. and we're never, never, never going. angel of god. take me along. happy days. quiet life. we are not alone...",https://genius.com/Talking-heads-bill-lyrics,0.215,0.752,0.034,0.966,0.5905
Talking Heads,Lifetime Piling Up,Others,1992,"i have tried marijuana, i get nervous every time. there will come a knockin' at the door. why is everybody makin' eyes at me?. i don't want to know. excuse and pardon me, stay for a while. maybe we'll never meet again. and i can see my lifetime pilin' up. i can see the days turn into nights. i can see the people on the street. open those windows up. a hundred floors below me. pilin' those houses up. pilin' them higher, higher, higher. i can feel them swayin' back and forth. building it higher, higher. this tower's leaning over. i got bad coordination, stuck a pencil in my eye. i can hardly wait to get back home. why is everybody gettin' paranoid?. i's only havin' fun. scumbags and superstars, tell me your names. i'll make a bet you're both the same. i can see my lifetime pilin' up. reaching from my bedroom to the stars. i can see the house where i was born. when i was growin' up. they say that i could never keep my trousers up. i remember days and crazy nights. are there any pirates on this ship?. and if they sober up. they'll have us home by morning. cry, cry, cry. it's just you and i. like an automobile. with no one at the wheel. we're spinning out of control. we're all over the road. in our sexy machine. oh, the passengers scream, scream, scream. i can see my lifetime pilin' up. i can see it smashin' into yours. it was not an accident at all. open your window up. i hear you laughin'. going one, two, three, four, five. goin' from the bottom to the top. maybe i'm holding on too tight. and now i'm throwin' up. i got a funny feeling. pilin' those houses up. pilin' them higher, higher, higher. building that highway to the stars. turning the music up. hey, i got a winning number",https://genius.com/Talking-heads-lifetime-piling-up-lyrics,0.084,0.821,0.094,0.906,0.495
Talking Heads,Once in a Lifetime,Remain in Light,1980,"and you may find yourself living in a shotgun shack. and you may find yourself in another part of the world. and you may find yourself behind the wheel of a large automobile. and you may find yourself in a beautiful house, with a beautiful wife. and you may ask yourself, ""well... how did i get here?"". . letting the days go by, let the water hold me down. letting the days go by, water flowing underground. into the blue again after the money's gone. once in a lifetime, water flowing underground. . and you may ask yourself, ""how do i work this?"". and you may ask yourself, ""where is that large automobile?"". and you may tell yourself, ""this is not my beautiful house"". and you may tell yourself, ""this is not my beautiful wife"". . letting the days go by, let the water hold me down. letting the days go by, water flowing underground. into the blue again after the money's gone. once in a lifetime, water flowing underground. . same as it ever was, same as it ever was. same as it ever was, same as it ever was. same as it ever was, same as it ever was. same as it ever was, same as it ever was. . water dissolving and water removing. there is water at the bottom of the ocean. under the water, carry the water. remove the water at the bottom of the ocean. water dissolving and water removing. . letting the days go by, let the water hold me down. letting the days go by, water flowing underground. into the blue again, into the silent water. under the rocks and stones, there is water underground. letting the days go by, let the water hold me down. letting the days go by, water flowing underground. into the blue again after the money's gone. once in a lifetime, water flowing underground. . you may ask yourself, ""what is that beautiful house?"". you may ask yourself, ""where does that highway go to?"". and you may ask yourself, ""am i right? am i wrong?"". and you may say to yourself, ""my god! what have i done?"". . letting the days go by, let the water hold me down. letting the days go by, water flowing underground. into the blue again, into the silent water. under the rocks and stones, there is water underground. letting the days go by, let the water hold me down. letting the days go by, water flowing underground. into the blue again after the money's gone. once in a lifetime, water flowing underground. . same as it ever was, same as it ever was. same as it ever was and look where my hand was. time isn't holding up, time isn't after us. same as it ever was, same as it ever was. same as it ever was, same as it ever was. same as it ever was, same as it ever was. letting the days go by, same as it ever was. here a twister comes, here comes the twister. same as it ever was, same as it ever was (letting the days go by). same as it ever was, same as it ever was (letting the days go by). once in a lifetime, let the water hold me down. letting the days go by, water flowing underground",https://genius.com/Talking-heads-once-in-a-lifetime-lyrics,0.047,0.953,0,1,0.5235
Talking Heads,Born Under Punches (The Heat Goes On),Remain in Light,1980,"take a look at these hands. take a look at these hands!. the hand speaks. the hand of a government man. well i'm a tumbler. born under punches. i'm so thin. . all i want is to breathe (i'm too thin). won't you breathe with me?. find a little space so we move in-between (in-between it). and keep one step ahead of yourself. . don't you miss it, don't you miss it. some 'a you people just about missed it. last time to make plans, well, i'm a tumbler. i'm a government man. . never seen anything like that before. falling bodies tumble 'cross the floor (but i'm a tumbler). when you get to where you wanna be (thank you, thank you). when you get to where you wanna be (don't even mention it!). . take a look at these hands, they're passing in-between us. take a look at these hands. take a look at these hands, you don't have to mention it. no thanks, i'm a government man. . and the heat goes on, and the heat goes on. and the heat goes on, and the heat goes on. and the heat goes on, where the hand has been. and the heat goes on, and the heat goes on. and the heat goes on (got time?), and the heat goes on. and the heat goes on, and the heat goes on. and the heat goes on, where the hand has been. and the heat goes on, and the heat goes on. and the heat goes on (i'm not a drowning man). and the heat goes on. and the heat goes on (and i'm not a burning building). and the heat goes on (i'm a tumbler). and the heat goes on (drowning cannot hurt a man). where the hand has been. and the heat goes on (fire cannot hurt a man). and the heat goes on (not the government man). and the heat goes on (all). and the heat goes on (i want). and the heat goes on (is to breathe). and the heat goes on (thank you, thank you). and the heat goes on (won't). and the heat goes on (you breathe). and the heat goes on (with me?). and the heat goes on. and the heat goes on (find). and the heat goes on (a little space). and the heat goes on (so we). and the heat goes on (move in-between) (no smoking). and the heat goes on (and keep). and the heat goes on (one step ahead). and the heat goes on (of yourself). and the heat goes on (i'm catching up with myself!). and the heat goes on (all). and the heat goes on (i want). and the heat goes on (is to breathe). and the heat goes on. and the heat goes on (won't). and the heat goes on (you breathe). and the heat goes on (with me?). and the heat goes on (hands of a government man). and the heat goes on (find). and the heat goes on (a little space). and the heat goes on (so we). and the heat goes on (move in-between). and the heat goes on (and keep). and the heat goes on (one step ahead). and the heat goes on (of yourself). and the heat goes on (don't you miss it, don't you miss it). and the heat goes on (all). and the heat goes on (i want). and the heat goes on (is to breathe). and the heat goes on. and the heat goes on (won't). and the heat goes on (you breathe). and the heat goes on (with me?). and the heat goes on (hands of a government man). and the heat goes on (find). and the heat goes on (a little space). and the heat goes on (so we). and the heat goes on (move in-between). and the heat goes on (and keep). and the heat goes on (one step ahead). and the heat goes on (of yourself)",https://genius.com/Talking-heads-born-under-punches-the-heat-goes-on-lyrics,0.064,0.924,0.012,0.988,0.526
Talking Heads,Crosseyed and Painless,Remain in Light,1980,"lost my shape trying to act casual. can't stop, i might end up in the hospital. changing my shape, i feel like an accident. they're back to explain their experience. . isn't it weird? looks too obscure to me. wasting away, that was the policy. . i'm ready to leave, i push the fact in front of me. facts lost, facts are never what they seem to be. there's nothing there, no information left of any kind. lifting my head, lo-lo-looking for danger signs. . there was a line, there was a formula. sharp as a knife, facts cut a hole in us. there was a line, there was a formula. sharp as a knife, facts cut a hole in us. . i'm still waiting. i-i-i'm still waiting. i'm still waiting. i-i-i'm still waiting. i'm still waiting. i-i-i'm still waiting. i'm still waiting. i-i-i'm still waiting. . the feeling returns whenever we close our eyes. lifting my head, looking around inside. . the island of doubt, it's like a taste of medicine. working by hindsight, got the message from the oxygen. m-m-making a list, find the cost of opportunity. doing it right, facts are useful in emergencies. . the feeling returns, whenever we close our eyes. lifting my head, looking around inside. . facts are simple and facts are straight. facts are lazy and facts are lame. facts don't come with points of view. facts don't do what i want them to. facts just twist the truth around. facts are living turned inside out. facts are getting the best of them. facts are nothing on the face of men. . i'm still waiting. i-i-i'm still waiting. i'm still waiting. i-i-i'm still waiting. i'm still waiting. i-i-i'm still waiting. i'm still waiting. i-i-i'm still waiting",https://genius.com/Talking-heads-crosseyed-and-painless-lyrics,0.114,0.794,0.092,0.908,0.511
