Artist,Title,Album,Year,Lyrics,Lyrics Link,pos,neu,neg,opp neg,final score
Talking Heads,Moon Rocks,Speaking in Tongues,1983,"flying saucers, levitation. yo! i could do that. gettin' ready for heavy duty. go on, give it a chance. give it a chance, give it a chance. i saw your hair start to curl. so get up, write it down. you better wait for a while. so take your hands out of your pockets and get your face adjusted. i heard it, somebody lied. and i'm staring out the window, gonna let this thing continue. in it's natural time. round heads, square heads. get settled in. you can hear my belly rumble. there's a voice that starts to mumble. woo! it's starting to sing. protons, neutrons. i ate a rock from the moon. got shocked once, shocked twice. let's see what it can do. a man in the moon, a moon in the man. i got a rock in my throat. upside, upside down. my tummy start to talk (what it say?). gonna rock it 'till i shock it, gonna kick it 'till i drop it. woo! love at first sight. you can kick it, you can poke it, woo! i think you broke it. ooh, what about that?. skin from a snake, blood from a stone. you know, that ain't no lie. i got hundreds of expressions, try to make a good impression. woo! right between the eye. i don't mind, let me go. right on time, i don't know. let me be, why not stay. i feel numb, let me play. i got wild imagination, talkin' transubstantiation. any version will do. i got mass communication, i'm the human corporation. i ate a rock from the moon. moon in the rock, rock in the moon. there's a moon in my throat. you might think i'm wasting time, you might laugh but not for long. hey! i'm working it out (work it out). i don't mind, let me go. sounds inside, i don't know. let me be, why not stay. i feel numb, let me play",https://genius.com/Talking-heads-moon-rocks-lyrics,0.12,0.841,0.038,0.962,0.541
Talking Heads,Pull Up the Roots,Speaking in Tongues,1983,"hello again. yes, indeed my friend. i can tell. gonna get together again. i could be right, i could be wrong. i feel nice when i sing this song. and i don't mind. whatever happens is fine. baby likes to keep on playing. what do i know, what do i know?. wilder than the place we live in. i'll take you there, i'll take you there. i don't mind some slight disorder. pull up the roots, pull up the roots. and i know every living creature. pull up the roots, pull up the roots. and i know you. i understand what you do. yes, indeed. i put the hat on my head. come out of your mess, bring yourself in. i feel nice when i start to sing. and i can see. everyone else is like me. towns that disappeared completely. pull up the roots, pull up the roots. miles and miles of endless highway. pull up the roots, pull up the roots. colored lights and shiny curtains. i'll take you there, i'll take you there. everything has been forgiven. pull up the roots, pull up the roots. well, i have a good time when i go out of my mind. and it's a wonderful place, and i can't wait to be there. and i hear beautiful sounds coming out of the ground. gonna take us a while, but we'll go hundreds of times. baby likes to keep on playing. what d'you know? what d'you know?. wilder than the place we live in. i'll take you there, i'll take you there. and i don't mind some slight disorder. pull up the roots, pull up the roots. and no more time for talkin' it over. pull up the roots, pull up the roots. well, i have a good time when i go out of my mind. and it's a wonderful place, and i can't wait to be there. and i hear beautiful sounds coming out of the ground. someone must have been high, but i guess it's alright",https://genius.com/Talking-heads-pull-up-the-roots-lyrics,0.146,0.815,0.039,0.961,0.5535
Talking Heads,I Get Wild/Wild Gravity,Speaking in Tongues,1983,"fooled around enough with numbers. let's not be ourselves today. is it my imagination?. is it just someone's face?. pleasantly out of proportion. it's hard to hold on to the ground. now i didn't come to run, and this is everything. and gravity lets you down. and i get wild, wising up. i just can't let go. i get wild when i get ready. and i can hardly talk. living lights, special lights. yellow turns to blue. and i get wild, it's automatic. and i can hardly move. go ahead and pull the curtains. check to see if i'm still here. let me lose my perspective. for something worth waiting for. somewhere in south carolina. and gravity don't mean a thing. and all around the world, each and everyone. playing with a heart of steel. i get up, climbing out. how did i get home?. i'll survive the situation. somebody shut the door. beautiful, beautiful. climbing up the wall. and i get by on automatic. no surprise at all. no one here can recognize you. here is everything that you like. feelings without explanations. somethings are hard to describe. the sound of a cigarette burning. a place there where everything spins. and the sounds inside your mind is playing all the time. you're playing with a heart of steel. and i get wild, wising up. i just can't let go. i get wild when i get ready. i can hardly talk. red and white, black to gold. yellow turns to blue. and i get wild, it's automatic. and i can hardly move. and i get up, pushing up. how did i get home?. i'll survive the situation. somebody shut the door. shut the door, shut the door. climbing up the wall. i get by-y-y-y on automatic. no surprise at all",https://genius.com/Talking-heads-i-get-wild-wild-gravity-lyrics,0.111,0.84,0.049,0.951,0.531
Talking Heads,Two Note Swivel,Speaking in Tongues,1983,"shoulders and knees. elbows and waist. how can you be in two places at once?. you twist yourself all ot of shape. whoop, there it is, do it again. the world is fiction. special effects. you can't believe what's coming next. sparks of light. balls of fire. whoop, what are we living for?. coming once. he's coming strong. he don't believe he could ever be wrong. he come to run. i came to stand. pick it up, do it again. i got my __. im on tv. wait a second, wait and see. a big __. a funny sound. whoop, there it is, now its gone",https://genius.com/Talking-heads-two-note-swivel-lyrics,0.084,0.867,0.05,0.95,0.517
Talking Heads,Psycho Killer,Talking Heads: 77,1977,"i can't seem to face up to the facts. i'm tense and nervous and i can't relax. i can't sleep 'cause my bed's on fire. don't touch me, i'm a real live wire. . psycho killer, qu'est-ce que c'est?. fa-fa-fa-fa, fa-fa-fa-fa-fa, fa, better. run, run, run, run, run, run, run away. oh, oh. psycho killer, qu'est-ce que c'est?. fa-fa-fa-fa, fa-fa-fa-fa-fa, far better. run, run, run, run, run, run, run away. oh, oh, oh, oh, aye-ya-ya-ya-ya. . you start a conversation, you can't even finish it. you're talking a lot, but you're not saying anything. when i have nothing to say, my lips are sealed. say something once, why say it again?. . psycho killer, qu'est-ce que c'est?. fa-fa-fa-fa, fa-fa-fa-fa-fa, fa, better. run, run, run, run, run, run, run away. oh, oh. psycho killer, qu'est-ce que c'est?. fa-fa-fa-fa, fa-fa-fa-fa-fa, fa, better. run, run, run, run, run, run, run away. oh, oh, oh, oh, aye-ya-ya-ya-ya. . ce que j'ai fait, ce soir-là. ce qu'elle a dit, ce soir-là. réalisant mon espoir. je me lave, vers la gloire, okay. aye-ya-ya-ya-ya-ya-ya-ya-ya-ya-ya-yeah. we are vain and we are blind. i hate people when they're not polite. . psycho killer, qu'est-ce que c'est?. fa-fa-fa-fa, fa-fa-fa-fa-fa, fa, better. run, run, run, run, run, run, run away. oh, oh. psycho killer, qu'est-ce que c'est?. fa-fa-fa-fa, fa-fa-fa-fa-fa, far better. run, run, run, run, run, run, run away. oh, oh, oh, oh, aye-ya-ya-ya-ya. . . hey, hey, hey, hey",https://genius.com/Talking-heads-psycho-killer-lyrics,0.079,0.742,0.179,0.821,0.45
Talking Heads,Don't Worry About the Government,Talking Heads: 77,1977,"i see the clouds that move across the sky. i see the wind that moves the clouds away. it moves the clouds over by the building. i pick the building that i want to live in. . i smell the pine trees and the peaches in the woods. i see the pinecones that fall by the highway. that's the highway that goes to the building. i pick the building that i want to live in. . it's over there, it's over there. my building has every convenience. it's gonna make life easy for me. it's gonna be easy to get things done. i will relax along with my loved ones. loved ones, loved ones visit the building. take the highway, park and come up and see me. i'll be working, working but if you come visit. i'll put down what i'm doing, my friends are important. . don't you worry 'bout me. i wouldn't worry about me. don't you worry 'bout me. don't you worry 'bout me. . i see the states across this big nation. i see the laws made in washington, d.c. i think of the ones i consider my favorites. i think of the people that are working for me. . some civil servants are just like my loved ones. they work so hard and they try to be strong. i'm a lucky guy to live in my building. they own the buildings to help them along. . it's over there, it's over there. my building has every convenience. it's gonna make life easy for me. it's gonna be easy to get things done. i will relax along with my loved ones. loved ones, loved ones visit the building. take the highway, park and come up and see me. i'll be working, working but if you come visit. i'll put down what i'm doing, my friends are important. . i wouldn't worry 'bout me. i wouldn't worry about me. don't you worry 'bout me. don't you worry 'bout me",https://genius.com/Talking-heads-dont-worry-about-the-government-lyrics,0.275,0.718,0.006,0.994,0.6345
Talking Heads,"Uh-Oh, Love Comes to Town",Talking Heads: 77,1977,"wait, wait for the moment to come. stand up, stand up and take my hand. believe, believe in mystery. love, love is simple as 1-2-3. . i'm a know-it-all, i'm smartest man around. that's right, you learn real fast through the smartest girl in town. . so, here come a riddle, here come a clue. if you were really smart, you'd know what to do when i say. . jump back, sit back, get back, relax, it's ok. i've called in sick, i won't go to work today. i'd rather be with the one i love. i neglect my duties, i'll be in trouble, but. . i've been to college, i've been to school. i've met the people that you read about in books. . here come a riddle, here come a clue. if you were really smart, you'd know what to do when i say. jet pilot gone out of control, ship captain on the ground. stock broker make a bad investment when love has come to town. . where, where is my common sense?. how did i get in a jam like this?. believe, i believe in mystery. love, love, love, love is simple as 1-2-3. . here come a riddle, here come a clue. if you were really smart, you'd know what to do when i say. why am i going out of my head whenever you're around?. the answer is obvious: love has come to town. . oh, oh, oh, oh",https://genius.com/Talking-heads-uh-oh-love-comes-to-town-lyrics,0.24,0.721,0.039,0.961,0.6005
Talking Heads,Sugar on My Tongue,Talking Heads: 77,1977,"oh-oh-oh-oh. oh-oh-oh-oh. she's my neighbor, fill my cup. i'll bet you, baby, she can fill it up. she'll put the sugar on my tongue. will she gimme, gimme, gimme some?. is she gonna put sugar on my tongue?. is she gonna gimme, gimme, gimme some?. she'll put it right there on my tongue. put it right there on my tongue. sweet, sweet, lover, lover. never, never, never find another. to put sugar on my tongue. gimme, gimme, gimme some. is she gonna put sugar on my tongue?. is she gonna gimme, gimme, gimme some?. she'll put it right there on my tongue. put it right there on my tongue. i've been waiting years and years. finally i see that you appear. my friends are here, and they ask of me. ""is this the time that we're gonna see her. put the sugar on your tongue?"". is she gonna put sugar on my tongue?. is she gonna put sugar on my tongue?. is she gonna gimme, gimme some?. she'll put it right there on my tongue. put it right there on my tongue. sugar, sugar on my tongue. oh-oh-oh-oh-oh. oh-oh-oh-oh-oh-oh-oh. oh-oh-oh-oh-oh-oh-oh. la-la-la-la-la-la. oh-oh-oh-oh, oh-oh-oh-oh. oh-oh-oh-oh, oh-oh-oh-oh",https://genius.com/Talking-heads-sugar-on-my-tongue-lyrics,0.085,0.915,0,1,0.5425
Talking Heads,Love → Building On Fire,Talking Heads: 77,1977,"when my love. stands next to your love. i can't compare love. when it's not love. it's not love. it's not love. which is my face. which is a building. which is on fire. on fire. when my love. stands next to your love. i can't define love. when it's not love. it's not love. it's not love. which is my face. which is a building. which is on fire. . i've got two loves. i've got two loves. and they go tweet tweet tweet tweet tweet tweet tweet tweet tweet like little birds. they're my two loves. and they go tweet tweet tweet tweet tweet tweet tweet tweet tweet like little birds. they're my two loves. count 'em one, two loves. count 'em one, two loves. which is my face. which is a building. which is on fire. on fire. when my love. stands next to your love. i can't define love. when it's not love. oh. it's not love. it's not love. which is my face. which is a building. which is on fire",https://genius.com/Talking-heads-love-building-on-fire-lyrics,0.406,0.537,0.057,0.943,0.6745
Talking Heads,The Book I Read,Talking Heads: 77,1977,"i'm writing 'bout the book i read. i have to sing about the book i read. i'm embarassed to admit it hit the soft spot in my heart. when i found out you wrote the book i read. so take my shoulders as they touch your arms. i've got little cold chills but i feel alright. the book i read was in your eyes. mmm-hmm, mmm-hmm. oh ho. oh, i'm living in the future. i feel wonderful, i'm tipping over backwards. i'm so ambitious, i'm looking back. i'm running a race and you're the book i read. so feel my fingers as they touch your arms. i'm spinning around but i feel alright. the book i read was in your eyes. ooh hoo, ah ha. oh ho, ooh. na na na na. na na na na na-na na. na na na na na. na na na na na-na na, ha, ha!. oh, na na na na. ooh na na na na na na na. mmm, na na na na. na na na na na-na na. ooh, na na na na. na na na na na-na na. na na na na. na na na na na-na na. na na na naa. oh ho, oh oh. oh oh. ooh, i'm living in the future. i feel wonderful, i'm tipping over backwards. i'm so ambitious, i'm looking back. i'm running a race and you're the book i read so. feel my fingers as they touch your arms. i'm spinning around and i feel alright. the book i read was in your eyes. ooh hoo, ah ha. oh ho, ooh. na na na na. na na na na na-na na. na na na na. na na na na na-na na, hey!. na na na na. na, na na na na-na-na-na na, oh ho. na na na na. ooh na na na na na, ah. ooh, na na na na. ooh! ah yeah. na na na na. ooh, ooh, ooh. na na na na na na na. ah na na, na, na na na na na. na na, na na na na na-na na. na na na na. ho ho, oh ho. oh ho, ooh",https://genius.com/Talking-heads-the-book-i-read-lyrics,0.115,0.885,0,1,0.5575
Talking Heads,No Compassion,Talking Heads: 77,1977,"in a world where people have problems. in this world where decisions are a way of life. other people's problems, they overwhelm my mind. they say compassion is a virtue, but i don't have the time. . so many people have their problems. i'm not interested in their problems. i guess i've experienced some problems. but now i've made some decisions and. it takes a lot of time to push away the nonsense. take my compassion, push it as far as it goes. my interest level's dropping, my interest level is dropping. i've heard all i want to and i don't want to hear any more. . what are you, in love with your problems?. i think you take it a little too far. it's not so cool to have so many problems. but don't expect me to explain your indecisions. go talk to your analyst, isn't that what they're paid for?. you walk, you talk, you still function like you used to. it's not a question of your personality or style. be a little more selfish, it might do you some good. . in a world where people have problems. in this world where decisions are a way of life. other people's problems, they overwhelm my mind. they say compassion is a virtue, but i don't have the time. . here we go again",https://genius.com/Talking-heads-no-compassion-lyrics,0.15,0.678,0.172,0.828,0.489
Talking Heads,New Feeling,Talking Heads: 77,1977,"it's not yesterday anymore. i go visiting, i talk loud. i try to make myself clear. in front of a face that's nearer. than it's ever been before. not this close before. nearer than before. not this close before. it is a million years ago. i hear music and it sounds like bells. i feel like my head is high. i wish i could meet everyone. meet them all over again. bring them up to my room. meet them all over again. everyone's up in my room. and now i'm busy again. i feel like sitting down. but i'm still thinking about my friends. in my guarded moments. but now i'm speaking out. speaking about my friends. now i'm speaking out. thinking about my friends",https://genius.com/Talking-heads-new-feeling-lyrics,0.166,0.834,0,1,0.583
Talking Heads,Pulled Up,Talking Heads: 77,1977,"oh, oh, oh, uh, oh, oh, oh, ah!. . mommy, daddy, come and look at me now. i'm a big man in a great big town. years ago, who would believe it's true?. goes to show what a little faith can do. . i was complaining, i was down in the dumps. i feel so strong now 'cause you pulled me up. pull me up, up, up, up, up, up, up, up!. . i slipped, and i got pulled. pulled up. i tripped, and then you pulled. you pulled me up. i slipped, and i got pulled. pulled up. i slipped, and then you pulled. you pulled me up. pull me up, pull me up, ah!. pulled me up, up, up, up, up, up, up, up!. . i drift away to another land. sleeping, dreaming, such a simple thing. i think of things that i might be. i see my name go down in history. . i was complaining, i was down in the dumps. i feel so strong now 'cause you pulled me up!. pull me up, up, up, up, up, up, up, up!. . i slipped, and i got pulled. pulled up. i tripped, and then you pulled. you pulled me up. i tripped, and i got pulled. pulled up. i slipped, and then you pulled. you pulled me up!. pulled me up, up, pulled me up, ah. na na na na na na na na na na na na. pulled me up, up, up, up, up, up, up, up!. . i got up. 'cause you pulled me up. i stood up. 'cause you pulled me up. i got up. and that was because you pulled me up. i got up. in a little while you pulled me up. pull me up, up, up, up, up, up, up, up!. aye-ya-ya-ya-ya-ya-ya-ya-ya-ya-ya-ya. pull me up, up, up, up, up, up, up, up!. aye-ya-ya-ya-ya-ya-ya-ya-ya-ya-ya-ya. . i cast a shadow on the living room wall. dark and savage with a profile so sharp. keep that wonderful food on the table. there's really no hurry, i'll eat in a while. . i was complaining, i was down in the dumps. i feel so strong now 'cause you pulled me up!. pull me up, up, up, up, up, up, up, up!. . i slipped, and i got pulled. pulled up. i tripped, and then you pulled. you pulled me up. i slipped, and i got pulled. pulled up. i slipped, and then you pulled. you pulled me up!. pulled me up, up, pulled me up, oh, i got!. ah-ya-ya-ya-ya-yeah. pulled me up, up, up, up, up, up, up, up!. ah-ya-ya-ya-ya-ya-ya-ya-ya-ya-ya-ya-ya-ya!. . pulled me up, up, up, up, up, up, up, up!. ah-ya-ya-ya-ya-ya-ya-ya-ya-ya-ya!. pulled me up, up, up, up, up, up, up, up!",https://genius.com/Talking-heads-pulled-up-lyrics,0.052,0.904,0.044,0.956,0.504
Talking Heads,Tentative Decisions,Talking Heads: 77,1977,"now that i can release my tensions. let me make clear my best intentions. girls ask: can i define decision?. boys ask: can i describe their function?. oh the boys want to talk. would like to talk about those problems. and the girls say they're concerned. -       (that they are). concerned with decisiveness. and it's a hard logic to follow. -       and the girls get lost. and the boys say they're concerned. -       (that they are). concerned with decisiveness. (i wanna talk) i wanna talk as much as i want. (i'm gonna give) i'm gonna give the problem to you. (i wanna talk) i wanna talk as much as i want. (i'm gonna give) i'm gonna give the problem to you. decide, decide, make up your mind. decide, decide, i told you what to say. confuse, confuse, describe what i found. confuse, confuse, i told you what to say*. . oh the girls still want to talk. would like to talk about those problems. and the boys say they're concerned. -       (that they are). concerned with decisiveness. and it's a hard logic i know. -       and the girls get lost. and the boys say they're concerned. -       (that they are). concerned with decisiveness. (i wanna talk) i wanna talk as much as i want. (i'm gonna give) i'm gonna give the problem to you. (i wanna talk) i wanna talk as much as i want. (i'm gonna give) i'm gonna give the problem to you. decide, decide, make up your mind. decide, decide, i told you what to say. confuse, confuse, describe what i found. confuse, confuse, i told you what to say",https://genius.com/Talking-heads-tentative-decisions-lyrics,0.07,0.779,0.15,0.85,0.46
Talking Heads,Psycho Killer (Acoustic),Talking Heads: 77,1977,"i can't seem to face up to the facts. i'm tense and nervous and i can't relax. i can't sleep, 'cause my bed's on fire. don't touch me, i'm a real live wire. psycho killer, qu'est-ce que c'est?. fa fa-fa fa, fa-fa fa-fa fa-far better. run run-run run, run run-run away. oh-ho-ho. psycho killer, qu'est-ce que c'est?. fa fa-fa fa, fa-fa fa-fa fa-far better. run run-run run, run run-run away. oh-ho-ho-ho, aye-yi-yi-yi-yi, ooh. i passed out hours ago. i'm sadder than you'll ever know. i've closed my eyes on this sunny day. say something once, why say it again?. psycho killer, qu'est-ce que c'est?. fa fa-fa fa, fa-fa fa-fa fa-far better. run run-run run, run run-run away. oh-ho-ho. psycho killer, qu'est-ce que c'est?. fa fa-fa fa, fa-fa fa-fa fa-far better. run run-run run, run run-run away. oh-ho-ho-ho, aye-yi-yi-yi-yi. ce que j'ai fait ce soir-là. ce qu'elle a dit ce soir-là. réalisant mon espoir. je me lance vers la gloire. okay. yeah, yeah, yeah, yeah, yeah, yeah. yeah, yeah, yeah, yeah, yeah, yeah. we are vain and we are blind. i hate people when they're not polite. psycho killer, qu'est-ce que c'est?. fa fa-fa fa, fa-fa fa-fa fa-far better. run run-run run, run run-run away. oh-ho-ho. psycho killer, qu'est-ce que c'est?. fa fa-fa fa, fa-fa fa-fa fa-far better. run run-run run, run run-run away. oh-ho-ho-ho, aye-yi-yi-yi-yi, ooh",https://genius.com/Talking-heads-psycho-killer-acoustic-lyrics,0.177,0.655,0.169,0.831,0.504
Talking Heads,Happy Day,Talking Heads: 77,1977,"in my sensations, i believe that i was. born with the things that i know. i want to talk like i read. before i decide what to do. and i fell all over and i couldn't stand up. i can't be critical, a heart won't stop. such a happy day for me. bring that happy day to me. send that happy day to me. and that happy day came to me, come to me, here it comes. i'm only looking. feel like my heart has a will of its own. i feel, feel nice inside. right here. and now it's summer again. the story i told, the story i made up. i was foolin' around but a heart can't stop. such a happy day for me. bring that happy day to me. send that happy day to me. and that happy day come to me, come to me, here it comes. this boy is in motion. some density moved right beside me. i want my sentence. right here. but now i'm far away. a sign was given but many years have passed. it cost a little bit to love you but a heart can't stop. such a happy day for me. bring that happy day to me. send that happy day to me. and that happy day came to me, come to me, here it comes. it's alright",https://genius.com/Talking-heads-happy-day-lyrics,0.101,0.736,0.163,0.837,0.469
Talking Heads,I Feel It In My Heart,Talking Heads: 77,1977,"ohhh dear. what if everything they say is true?. ohhh, ohhh dear. then there won't be anything for me and you. well. even if we have to start all over again. what will be the point in being a fool again?. even if, even if we have to start all over again. oh what will be, what will be, what will be. the point in being a fool again?. oh oh oh...no no no. i made a decision. revised it again. i saw what it meant to both my parents and friends. and i couldn't do it if i had tried. i couldn't hide my feelings inside. i say that's not my way, that's not my way. that's not like me, that's not like me. that's not my way, that's not my way. that's not like me, that's not like me. i couldn't do it, i couldn't do it. ohh and i tried, i tried and i tried. i say that's not like me, that's not like me. that's not my way, that's not my way. i couldn't do it, i couldn't do it. i couldn't try, try try try. that's not my way, that's not my way. that ain't my way. if i feel it in my heart. ohhh ohhh",https://genius.com/Talking-heads-i-feel-it-in-my-heart-lyrics,0.056,0.834,0.11,0.89,0.473
Talking Heads,First Week/Last Week...Carefree,Talking Heads: 77,1977,"can we run that again. is that a woman's voice i hear?. i said, ""let's wait and see. i'll see for myself"". that's a phrase i repeat. to myself. made a reference to me and. that's myself too. . what progress i have made the first week. first week. first week. first week. . every sentence i use. refer to women and their names. i heard, heard the voice first last week. i heard it myself. made a reference to me and. that's myself. this report's incomplete. i can see for myself. . every appointment has been moved to last week. last week. last week. last week. . i heard the voice first last week. i heard it myself. made a reference to me. and that's myself. this report's incomplete. i can see for myself. . every appointment has been moved to last week. last week. last week. last week",https://genius.com/Talking-heads-first-week-last-week-carefree-lyrics,0.031,0.969,0,1,0.5155
